prov_name,kab_name,kec_name,link_sekolah_kita,link_referensi,nama,npsn,alamat,desa/kelurahan,kecamatan/kota_(ln),kab.-kota/negara_(ln),propinsi/luar_negeri_(ln),status_sekolah,bentuk_pendidikan,program_/_layanan,kementerian_pembina,naungan,npyp,no._sk._pendirian,tanggal_sk._pendirian,nomor_sk_operasional,tanggal_sk_operasional,file_sk_operasional,tanggal_upload_sk_op.,akreditasi,luas_tanah,akses_internet,akses_internet_2,sumber_listrik,fax,telepon,email,website,lintang,bujur,guru,siswa_laki_laki,siswa_perempuan,rombongan_belajar,kurikulum,penyelenggaraan,manajemen_berbasis_sekolah,semester_data,daya_listrik,ruang_kelas,laboratorium,perpustakaan,sanitasi_siswa,guru_pns,guru_gtt,guru_gty,guru_honor,guru_gol_i,guru_gol_ii,guru_gol_iii,guru_gol_iv,guru_sertifikasi,guru_belum_sertifikasi,guru_kurang_dari_s1,guru_s1_atau_lebih,guru_data_kosong,guru_kurang_dari_30_tahun,guru_31_35_tahun,guru_36_40,guru_41_45_tahun,guru_46_50_tahun,guru_51_55_tahun,guru_lebih_dari_55_tahun,guru_laki_laki,guru_perempuan,akses_internet_sekolah_kita
Lampung,Kab. Lampung Tengah,Punggur,https://sekolah.data.kemdikbud.go.id/index.php/Chome/profil/743422DC-14D0-4AF6-92B0-65DBFE95218A,https://referensi.data.kemdikbud.go.id/pendidikan/npsn/K9997845,LKP CIKAL CENDIKIA,K9997845,Jln. Brawijaya No. 01 RT/RW.01/01 Dusun.05 Karang Anyar,MOJO PAHIT,KEC. PUNGGUR,KAB. LAMPUNG TENGAH,PROV. LAMPUNG,SWASTA,Kursus,KKNI Level 3,"Kementerian Pendidikan, Kebudayaan, Riset, dan Teknologi",YAYASAN CIKAL CENDEKIA AZ ZAHRO LAMPUNG,AW9428,A1/028/SK/YCCAL/X/2021,02-10-2021,503/0001/075/D.b.VI.18/I/2022,13-01-2022,Lihat SK Operasional,2022-02-24 09,,750,,2.,,082182895976,,ftpk.lamteng@gmail.com,,.000000000000,.000000000000,0,0,0,1,KBK Teknologi Informasi dan Komunikasi,,,2022/2023-2,,0,0,0,0,0,0,2,0,0,0,0,0,0,0,0,0,0,0,0,0,0,0,0,0,0,0,
Lampung,Kab. Lampung Tengah,Punggur,https://sekolah.data.kemdikbud.go.id/index.php/Chome/profil/DDD58522-3AB1-4BE2-AA94-80EC490EE329,https://referensi.data.kemdikbud.go.id/pendidikan/npsn/P9962930,PKBM CENDIKIA,P9962930,Jl Brawijaya Rt.01/01 Dsn.V Kampung Mojopahit Kec.Punggur Lampung Tengah,MOJO PAHIT,KEC. PUNGGUR,KAB. LAMPUNG TENGAH,PROV. LAMPUNG,SWASTA,PKBM,"Paket A, Paket B,  dan Paket C","Kementerian Pendidikan, Kebudayaan, Riset, dan Teknologi",YAYASAN CIKAL CENDEKIA AZ ZAHRO LAMPUNG,AW9428,012/kpts-lkpa/VII/2012,10-07-2012,503/0013/075/D.b.VI.18/XI/2020,03-11-2020,Lihat SK Operasional,2022-04-14 04,A,"1,689",1. -,2. Lainnya (Wavelan),PLN,,,lkpa_lamteng@yahoo.com,http,-4.989000000000,105.244400000000,5,0,0,11,2013,Sehari Penuh/3 hari,,2022/2023-2,884,5,0,1,0,0,0,17,1,5,0,0,0,0,5,0,1,4,4,1,0,0,0,0,0,3,2,Tidak Ada
Lampung,Kab. Lampung Tengah,Punggur,https://sekolah.data.kemdikbud.go.id/index.php/Chome/profil/A6EBE1ED-15A1-49EF-86F7-7A7BED85F6DB,https://referensi.data.kemdikbud.go.id/pendidikan/npsn/P9997261,PKBM MAHAD TAHKIMUSSUNNAH AL-ISLAMY,P9997261,JL. PATTIMURA METRO - PUNGGUR KM 6,NUNGGAL REJO,KEC. PUNGGUR,KAB. LAMPUNG TENGAH,PROV. LAMPUNG,SWASTA,PKBM,Paket C dan PAUD,"Kementerian Pendidikan, Kebudayaan, Riset, dan Teknologi",YAYASAN AL-MARKAZ ASSALAFY LITTA'ALUM WATTA'LIM WATTA'SHIL,AC1144,098/B.1-YMS/VI/2020,20-06-2020,503/0009/075/D.b.VI.18/III/2021,09-03-2021,Lihat SK Operasional,2022-03-22 09,,"10,252",1. -,2. Lainnya (Wavelan),PLN,,,pkbm.matsilpunggur@gmail.com,http,-5.072300000000,105.279900000000,14,0,0,8,2013,Pagi/6 hari,,2022/2023-2,900,8,0,0,3,0,0,14,2,14,0,0,0,0,14,1,8,5,2,4,3,2,3,0,0,6,8,Tidak Ada
Lampung,Kab. Lampung Tengah,Punggur,https://sekolah.data.kemdikbud.go.id/index.php/Chome/profil/35B567A8-4963-4B53-811D-7F901262B011,https://referensi.data.kemdikbud.go.id/pendidikan/npsn/P9956794,PKBM MUFIDAH,P9956794,Jl.Setia Budi Kampung Sido Mulyo Rt.11/006 Kec.Punggur Lampung Tengah,SIDO MULYO,KEC. PUNGGUR,KAB. LAMPUNG TENGAH,PROV. LAMPUNG,SWASTA,PKBM,Paket B dan Paket C,"Kementerian Pendidikan, Kebudayaan, Riset, dan Teknologi",,,800/70/D.1/2009,14-04-2009,421.9/2293.e/05/D.1/2016,25-07-2016,Lihat SK Operasional,2021-09-29 02,C,96,1. Indosat IM3,2. Lainnya,PLN,,,pkbmmufidahpunggur18@gmail.com,,-5.033300000000,105.281800000000,9,0,0,6,2013,Sehari Penuh/3 hari,,2022/2023-2,840,5,0,1,2,1,0,5,1,8,0,1,0,1,8,0,3,6,1,2,0,1,1,2,2,4,5,Indosat IM3
Lampung,Kab. Lampung Tengah,Punggur,https://sekolah.data.kemdikbud.go.id/index.php/Chome/profil/49F2A2C1-5DAF-415E-B006-D6CD17050192,https://referensi.data.kemdikbud.go.id/pendidikan/npsn/P9956789,SKB LAMPUNG TENGAH,P9956789,Jl.Raya Punggur-Kota Gajah Kampung Sidomuluyo Kec.Punggur Kab.Lampung Tengah,SIDO MULYO,KEC. PUNGGUR,KAB. LAMPUNG TENGAH,PROV. LAMPUNG,NEGERI,SKB,"Paket A, Paket B, Paket C,  dan PAUD","Kementerian Pendidikan, Kebudayaan, Riset, dan Teknologi",Pemerintah Daerah,,No.5,02-05-2007,No.18,13-06-2016,Lihat SK Operasional,2021-08-18 16,A,"11,000",1. Telkomsel Flash,2. Telkom Speedy,PLN,,,skblamteng@gmail.com,,-5.038300000000,105.283700000000,10,0,0,12,2013,Pagi/6 hari,,2022/2023-2,"2,200",13,0,0,4,1,0,0,9,9,0,1,0,0,10,1,6,3,4,1,3,1,1,0,0,1,9,Telkomsel Flash
