prov_name,kab_name,kec_name,link_sekolah_kita,link_referensi,nama,npsn,alamat,desa/kelurahan,kecamatan/kota_(ln),kab.-kota/negara_(ln),propinsi/luar_negeri_(ln),status_sekolah,bentuk_pendidikan,program_/_layanan,kementerian_pembina,naungan,npyp,no._sk._pendirian,tanggal_sk._pendirian,nomor_sk_operasional,tanggal_sk_operasional,file_sk_operasional,tanggal_upload_sk_op.,akreditasi,luas_tanah,akses_internet,akses_internet_2,sumber_listrik,fax,telepon,email,website,lintang,bujur,guru,siswa_laki_laki,siswa_perempuan,rombongan_belajar,kurikulum,penyelenggaraan,manajemen_berbasis_sekolah,semester_data,daya_listrik,ruang_kelas,laboratorium,perpustakaan,sanitasi_siswa,guru_pns,guru_gtt,guru_gty,guru_honor,guru_gol_i,guru_gol_ii,guru_gol_iii,guru_gol_iv,guru_sertifikasi,guru_belum_sertifikasi,guru_kurang_dari_s1,guru_s1_atau_lebih,guru_data_kosong,guru_kurang_dari_30_tahun,guru_31_35_tahun,guru_36_40,guru_41_45_tahun,guru_46_50_tahun,guru_51_55_tahun,guru_lebih_dari_55_tahun,guru_laki_laki,guru_perempuan,akses_internet_sekolah_kita
Lampung,Kota Bandar Lampung,Teluk Betung Utara,https://sekolah.data.kemdikbud.go.id/index.php/Chome/profil/0AECD1DA-028B-4B21-931B-24EC48829D7C,https://referensi.data.kemdikbud.go.id/pendidikan/npsn/K5661124,LKP BIMBEL LEVI,K5661124,Jl. Dr. Ciptomangunkusumo No. 4 Kel. sumur batu,SUMUR BATU,KEC. TELUK BETUNG UTARA,KOTA BANDAR LAMPUNG,PROV. LAMPUNG,SWASTA,Kursus,,"Kementerian Pendidikan, Kebudayaan, Riset, dan Teknologi",Lainnya,,02,16-07-2014,420.9 / 504 / IV.40 / 2015,19-02-2016,Lihat SK Operasional,2019-05-06 14,C,0,,2.,,0,,lkpbimbellevi@yahoo.com,,-5.432600000000,105.262500000000,0,0,0,0,KBK Teknologi Informasi dan Komunikasi,,,2022/2023-2,,0,0,0,0,0,0,2,0,0,0,0,0,0,0,0,0,0,0,0,0,0,0,0,0,0,0,
Lampung,Kota Bandar Lampung,Teluk Betung Utara,https://sekolah.data.kemdikbud.go.id/index.php/Chome/profil/3751BAA5-E745-47B0-A3F9-12A7AAED8D05,https://referensi.data.kemdikbud.go.id/pendidikan/npsn/K9998111,LKP NA2,K9998111,Jl. Dr. Cipto Mangun Kusumo Gg. Anyelir No. 48,KUPANG TEBA,KEC. TELUK BETUNG UTARA,KOTA BANDAR LAMPUNG,PROV. LAMPUNG,SWASTA,Kursus,,"Kementerian Pendidikan, Kebudayaan, Riset, dan Teknologi",Lainnya,,1871/503/00052/421-IPNF.KP/III.16/VI/2022,14-06-2022,1871/503/00052/421-IPNF.KP/III.16/VI/2022,14-06-2022,Lihat SK Operasional,2022-06-24 14,,120,,2.,,,,,,.000000000000,.000000000000,0,0,0,0,,,,2022/2023-2,,0,0,0,0,0,0,0,0,0,0,0,0,0,0,0,0,0,0,0,0,0,0,0,0,,,
Lampung,Kota Bandar Lampung,Teluk Betung Utara,https://sekolah.data.kemdikbud.go.id/index.php/Chome/profil/C1D44648-C3C4-45E7-A1B3-AAB8B15B46ED,https://referensi.data.kemdikbud.go.id/pendidikan/npsn/P9908465,PKBM BINA KARYA MANDIRI,P9908465,JL. RASUNA SAID NO.9 KEL.,GULAK GALIK,KEC. TELUK BETUNG UTARA,KOTA BANDAR LAMPUNG,PROV. LAMPUNG,SWASTA,PKBM,"Paket A, Paket B,  dan Paket C","Kementerian Pendidikan, Kebudayaan, Riset, dan Teknologi",,,421.9/003/III.16/2018,16-05-2016,421.9/003/III.16/2018,16-05-2016,Silakan Upload SK (link file tidak valid) => [138080-106483321-652329989.PDF],2019-05-27 11,,0,1. 3 (Tri),2. 3 (Tri),PLN,,,,,-5.427800000000,105.280700000000,3,0,0,6,Paket C IPS 2013,Pagi/6 hari,,2022/2023-2,900,4,0,0,2,0,0,2,2,3,0,0,0,0,3,0,1,2,1,2,0,0,0,0,0,0,3,3 (Tri)
Lampung,Kota Bandar Lampung,Teluk Betung Utara,https://sekolah.data.kemdikbud.go.id/index.php/Chome/profil/E91933A1-7304-47D8-8614-C0F8E24B9740,https://referensi.data.kemdikbud.go.id/pendidikan/npsn/P9998016,PKBM LEVI,P9998016,Jl.Dr Ciptomangunkusumo No 4,SUMUR BATU,KEC. TELUK BETUNG UTARA,KOTA BANDAR LAMPUNG,PROV. LAMPUNG,SWASTA,PKBM,"Paket A, Paket B,  dan Paket C","Kementerian Pendidikan, Kebudayaan, Riset, dan Teknologi",Lainnya,,1871/503/00038/421-IPNF.KP/III.16/I/2022,27-01-2022,1871/503/00038/421-IPNF.KP/III.16/I/2022,27-01-2022,Lihat SK Operasional,2022-02-24 09,,200,1. -,2. -,PLN,,,,,.000000000000,.000000000000,2,0,0,4,2013,Malam/6 hari,,2022/2023-2,"1,300",1,0,0,0,0,0,3,1,2,0,0,0,0,2,0,2,0,0,0,1,0,1,0,0,1,1,Tidak Ada
Lampung,Kota Bandar Lampung,Teluk Betung Utara,https://sekolah.data.kemdikbud.go.id/index.php/Chome/profil/D2795AE4-DA8F-498B-B6AD-45A8D967BAE5,https://referensi.data.kemdikbud.go.id/pendidikan/npsn/P9908463,PKBM PUTRI ANYELIR,P9908463,JL. DR. CIPTO MANGUN KUSUMO GG. ANYELIR NO. 48,KUPANG KOTA,KEC. TELUK BETUNG UTARA,KOTA BANDAR LAMPUNG,PROV. LAMPUNG,SWASTA,PKBM,"Paket A, Paket B,  dan Paket C","Kementerian Pendidikan, Kebudayaan, Riset, dan Teknologi",Yayasan PKBM PUTRI ANYELIR,AF3705,420.9/2635/08/2009,14-10-2009,421.9/887/IV.40/2017,18-11-2015,Lihat SK Operasional,2018-08-24 08,B,128,1. -,2. Telkom Speedy,PLN,,,Putri_Anyelir34@yahoo.com,,-5.436200000000,105.272600000000,1,0,0,8,2013,Siang/6 hari,,2022/2023-2,"1,300",3,0,1,0,0,0,9,0,1,0,0,0,0,1,0,1,0,1,0,0,0,0,0,0,0,1,Tidak Ada
