prov_name,kab_name,kec_name,link_sekolah_kita,link_referensi,nama,npsn,alamat,desa/kelurahan,kecamatan/kota_(ln),kab.-kota/negara_(ln),propinsi/luar_negeri_(ln),status_sekolah,bentuk_pendidikan,kementerian_pembina,naungan,npyp,no._sk._pendirian,tanggal_sk._pendirian,nomor_sk_operasional,tanggal_sk_operasional,file_sk_operasional,tanggal_upload_sk_op.,akreditasi,luas_tanah,akses_internet,akses_internet_2,sumber_listrik,fax,telepon,email,website,lintang,bujur,guru,siswa_laki_laki,siswa_perempuan,rombongan_belajar,penyelenggaraan,manajemen_berbasis_sekolah,semester_data,daya_listrik,ruang_kelas,laboratorium,perpustakaan,sanitasi_siswa,guru_pns,guru_gtt,guru_gty,guru_honor,guru_gol_i,guru_gol_ii,guru_gol_iii,guru_gol_iv,guru_sertifikasi,guru_belum_sertifikasi,guru_kurang_dari_s1,guru_s1_atau_lebih,guru_data_kosong,guru_kurang_dari_30_tahun,guru_31_35_tahun,guru_36_40,guru_41_45_tahun,guru_46_50_tahun,guru_51_55_tahun,guru_lebih_dari_55_tahun,guru_laki_laki,guru_perempuan
Jawa Timur,Kab. Bondowoso,Maesan,https://sekolah.data.kemdikbud.go.id/index.php/Chome/profil/F733CDC0-FD63-4203-8D73-87EF05385DC8,https://referensi.data.kemdikbud.go.id/pendidikan/npsn/70016312,Akademi Kebidanan Dharma Praja Bondowoso,70016312,JL. MT HARIYONO 30 A BONDOWOSO,KEC. MAESAN,KAB. BONDOWOSO,PROV. JAWA TIMUR,INDONESIA,SWASTA,Akademik,"Kementerian Pendidikan, Kebudayaan, Riset, dan Teknologi",,,42DO2009,07-04-2009,,,Silakan Upload SK,,,0 m2,1.,2.,,0332420060,0332420060,akbid_dpraja@yahoo.co.id,http,-7.914339200000,113.816475700000,,,,,,,,,,,,,,,,,,,,,,,,,,,,,,,,,,
Jawa Timur,Kab. Bondowoso,Maesan,https://sekolah.data.kemdikbud.go.id/index.php/Chome/profil/95085FEE-710D-45D5-BBB8-6F69F66DEC85,https://referensi.data.kemdikbud.go.id/pendidikan/npsn/70019613,Sekolah Tinggi Agama Islam Sayid Mohammad Alawi Al Maliki,70019613,,KEC. MAESAN,KAB. BONDOWOSO,PROV. JAWA TIMUR,INDONESIA,SWASTA,Sekolah Tinggi,"Kementerian Pendidikan, Kebudayaan, Riset, dan Teknologi",,,791 Tahun 2021,10-08-2021,,,Silakan Upload SK,,,1.364 m2,1.,2.,,,,staialmaliki102@gmail.com,www.stisalmaliki.ac.id,-7.932500200000,113.830375700000,,,,,,,,,,,,,,,,,,,,,,,,,,,,,,,,,,
Jawa Timur,Kab. Bondowoso,Maesan,https://sekolah.data.kemdikbud.go.id/index.php/Chome/profil/37209AD6-2825-4F84-B5A6-13A4AB76EE96,https://referensi.data.kemdikbud.go.id/pendidikan/npsn/70020168,Sekolah Tinggi Ilmu Syari'ah Darul Falah Bondowoso Jawa Timur,70020168,Jalan KH. Massyur Desa Ramban Kulon Kec. Cerme Bondowoso,PUJERBARU,KEC. MAESAN,KAB. BONDOWOSO,PROV. JAWA TIMUR,SWASTA,Sekolah Tinggi,"Kementerian Pendidikan, Kebudayaan, Riset, dan Teknologi",,,Nomor,21-08-2017,,,Silakan Upload SK,,,0 m2,1.,2.,,,,stisdafabondowoso@gmail.com,stisdafabondowoso.ac.id,-7.787583000000,114.018301000000,,,,,,,,,,,,,,,,,,,,,,,,,,,,,,,,,,
Jawa Timur,Kab. Bondowoso,Maesan,https://sekolah.data.kemdikbud.go.id/index.php/Chome/profil/69970AD5-EC1D-4975-85AF-C95A63BB9498,https://referensi.data.kemdikbud.go.id/pendidikan/npsn/70020187,Sekolah Tinggi Ilmu Syariah Sayid mohammad Alawi Al Maliki Bondowoso Jawa Timur,70020187,Desa Koncer Darul Aman RT. 003 RW 002 Kecamatan Tenggarang Kabupaten Bondowoso J,MAESAN,KEC. MAESAN,KAB. BONDOWOSO,PROV. JAWA TIMUR,SWASTA,Sekolah Tinggi,"Kementerian Pendidikan, Kebudayaan, Riset, dan Teknologi",,,Nomor,26-05-2017,,,Silakan Upload SK,,,0,,2.,,0332423014,,stis.almaliki12@gmail.com,www.stisalmalikibondowoso.com,-7.932078000000,113.836534000000,0,0,0,0,,,2022/2023-2,,0,0,0,0,0,0,0,0,0,0,0,0,0,0,0,0,0,0,0,0,0,0,0,0,,
Jawa Timur,Kab. Bondowoso,Maesan,https://sekolah.data.kemdikbud.go.id/index.php/Chome/profil/09448507-FFEE-4A85-98FC-FCA705BF7000,https://referensi.data.kemdikbud.go.id/pendidikan/npsn/70020918,STAI At-Taqwa Bondowoso Jawa Timur,70020918,Kampus I,PAKUNIRAN,KEC. MAESAN,KAB. BONDOWOSO,PROV. JAWA TIMUR,SWASTA,Sekolah Tinggi,"Kementerian Pendidikan, Kebudayaan, Riset, dan Teknologi",,,NOMOR,23-07-2003,,,Silakan Upload SK,,,0 m2,1.,2.,,0332420428,0332420428,staiattaqwabws@gmail.com,staiattaqwabondowoso.ac.id,-7.922235000000,113.832250000000,,,,,,,,,,,,,,,,,,,,,,,,,,,,,,,,,,
Jawa Timur,Kab. Bondowoso,Maesan,https://sekolah.data.kemdikbud.go.id/index.php/Chome/profil/BA297F6B-C36A-4F0E-8557-863E342D7922,https://referensi.data.kemdikbud.go.id/pendidikan/npsn/70021489,STIT Al-Ishlah Bondowoso,70021489,Jl. Raya Jember No. 17-19 Dadapan Grujugan Bondowoso Jawa Timur,MAESAN,KEC. MAESAN,KAB. BONDOWOSO,PROV. JAWA TIMUR,SWASTA,Sekolah Tinggi,"Kementerian Pendidikan, Kebudayaan, Riset, dan Teknologi",,,,01-01-2010,,,Silakan Upload SK,,,0 m2,1.,2.,,0332-427320,0332-424027,stit.alishlahbdw@gmail.com,https,-7.975317000000,113.795588000000,,,,,,,,,,,,,,,,,,,,,,,,,,,,,,,,,,
