prov_name,kab_name,kec_name,link_sekolah_kita,link_referensi,nama,npsn,alamat,desa/kelurahan,kecamatan/kota_(ln),kab.-kota/negara_(ln),propinsi/luar_negeri_(ln),status_sekolah,bentuk_pendidikan,kementerian_pembina,naungan,npyp,no._sk._pendirian,tanggal_sk._pendirian,nomor_sk_operasional,tanggal_sk_operasional,file_sk_operasional,tanggal_upload_sk_op.,akreditasi,luas_tanah,akses_internet,akses_internet_2,sumber_listrik,fax,telepon,email,website,lintang,bujur
Sumatera Utara,Kota Medan,Medan Petisah,https://sekolah.data.kemdikbud.go.id/index.php/Chome/profil/BF328652-489C-4DC2-980F-AE1F9EDF6740,https://referensi.data.kemdikbud.go.id/pendidikan/npsn/70016335,Akademi Kebidanan Hisarma Medan,70016335,Jl Gatot Subroto No 108128,KEC. MEDAN PETISAH,KOTA MEDAN,PROV. SUMATERA UTARA,INDONESIA,SWASTA,Akademik,"Kementerian Pendidikan, Kebudayaan, Riset, dan Teknologi",,,124YRSUHVIII2008,03-09-2008,,,Silakan Upload SK,,,0 m2,1.,2.,,,8451868,akbid_hisarma@yahoo.com,www.hisarma.ac.id,,
Sumatera Utara,Kota Medan,Medan Petisah,https://sekolah.data.kemdikbud.go.id/index.php/Chome/profil/6D479C90-3F92-4548-ABFB-B99B46DC36A4,https://referensi.data.kemdikbud.go.id/pendidikan/npsn/70016639,Akademi Keperawatan RSU Herna,70016639,"JL Dr TD Pardede No.21, Petisah Hulu, Medan Baru, Kota Medan",PETISAH TENGAH,KEC. MEDAN PETISAH,KOTA MEDAN,PROV. SUMATERA UTARA,SWASTA,Akademik,"Kementerian Pendidikan, Kebudayaan, Riset, dan Teknologi",,,18DO2009,02-03-2009,,,Silakan Upload SK,,,0 m2,1.,2.,,,,,,,
Sumatera Utara,Kota Medan,Medan Petisah,https://sekolah.data.kemdikbud.go.id/index.php/Chome/profil/7D42DA72-9FFE-45D2-8F61-4E54A4514AA3,https://referensi.data.kemdikbud.go.id/pendidikan/npsn/10215324,Akademi Pariwisata Dan Perhotelan Darma Agung,10215324,Jl Dr Td Pardede No 21,KEC. MEDAN PETISAH,KOTA MEDAN,PROV. SUMATERA UTARA,INDONESIA,SWASTA,Akademik,"Kementerian Pendidikan, Kebudayaan, Riset, dan Teknologi",,,0144O1987,09-03-1987,,,Silakan Upload SK,,,0 m2,1.,2.,,(061) 4529514,(061) 4529514,appdarmaagung@yahoo.co.id,www.akpardarmaagung.ac.id,,
Sumatera Utara,Kota Medan,Medan Petisah,https://sekolah.data.kemdikbud.go.id/index.php/Chome/profil/6FEEF618-C95A-4F3F-B0FB-CE4D659C37A4,https://referensi.data.kemdikbud.go.id/pendidikan/npsn/70016899,Akademi Teknologi Industri Immanuel,70016899,Jalan Gatot Subroto No 325  Medan,KEC. MEDAN PETISAH,KOTA MEDAN,PROV. SUMATERA UTARA,INDONESIA,SWASTA,Akademik,"Kementerian Pendidikan, Kebudayaan, Riset, dan Teknologi",,,29/D/O/1998,06-05-1998,,,Silakan Upload SK,,,0 m2,1.,2.,,(061)4154154,(061)4569548,perguruanimmanuel@gmail.com,www.perguruanimmanuel.web.id,,
Sumatera Utara,Kota Medan,Medan Petisah,https://sekolah.data.kemdikbud.go.id/index.php/Chome/profil/FC0EA281-C6F7-475A-B624-96B2A4F16611,https://referensi.data.kemdikbud.go.id/pendidikan/npsn/70019276,Politeknik Trijaya Krama,70019276,Jalan Iskandar Muda Nomor 3 D Medan,KEC. MEDAN PETISAH,KOTA MEDAN,PROV. SUMATERA UTARA,INDONESIA,SWASTA,Politeknik,"Kementerian Pendidikan, Kebudayaan, Riset, dan Teknologi",,,393/M/KPT/2018,21-12-2018,,,Silakan Upload SK,,,0 m2,1.,2.,,,061 88813414,politeknik.trijaya@yahoo.com,www.politeknik-trijaya.ac.id,,
Sumatera Utara,Kota Medan,Medan Petisah,https://sekolah.data.kemdikbud.go.id/index.php/Chome/profil/D66839A1-6A15-4D85-9E6E-9C8C01DE0AB6,https://referensi.data.kemdikbud.go.id/pendidikan/npsn/10215409,Universitas Darma Agung,10215409,Jalan Dr Td Pardede No 21,KEC. MEDAN PETISAH,KOTA MEDAN,PROV. SUMATERA UTARA,INDONESIA,SWASTA,Universitas,"Kementerian Pendidikan, Kebudayaan, Riset, dan Teknologi",,,571957,11-12-1957,,,Silakan Upload SK,,,0 m2,1.,2.,,,,,,3.578584300000,98.664783600000
Sumatera Utara,Kota Medan,Medan Petisah,https://sekolah.data.kemdikbud.go.id/index.php/Chome/profil/93207A53-12D4-4F32-B32D-E088EC5A2A34,https://referensi.data.kemdikbud.go.id/pendidikan/npsn/10215421,Universitas Prima Indonesia,10215421,Jalan Sekip Simpang Sikambing,SEI PUTIH TIMUR I,KEC. MEDAN PETISAH,KOTA MEDAN,PROV. SUMATERA UTARA,SWASTA,Universitas,"Kementerian Pendidikan, Kebudayaan, Riset, dan Teknologi",,,151DO2005,13-10-2005,,,Silakan Upload SK,,,0 m2,1.,2.,,,,,,3.598824100000,98.652809000000
