prov_name,kab_name,kec_name,link_sekolah_kita,link_referensi,nama,npsn,alamat,desa/kelurahan,kecamatan/kota_(ln),kab.-kota/negara_(ln),propinsi/luar_negeri_(ln),status_sekolah,bentuk_pendidikan,kementerian_pembina,naungan,npyp,no._sk._pendirian,tanggal_sk._pendirian,nomor_sk_operasional,tanggal_sk_operasional,file_sk_operasional,tanggal_upload_sk_op.,akreditasi,luas_tanah,akses_internet,akses_internet_2,sumber_listrik,fax,telepon,email,website,lintang,bujur,guru,siswa_laki_laki,siswa_perempuan,rombongan_belajar,penyelenggaraan,manajemen_berbasis_sekolah,semester_data,daya_listrik,ruang_kelas,laboratorium,perpustakaan,sanitasi_siswa,guru_pns,guru_gtt,guru_gty,guru_honor,guru_gol_i,guru_gol_ii,guru_gol_iii,guru_gol_iv,guru_sertifikasi,guru_belum_sertifikasi,guru_kurang_dari_s1,guru_s1_atau_lebih,guru_data_kosong,guru_kurang_dari_30_tahun,guru_31_35_tahun,guru_36_40,guru_41_45_tahun,guru_46_50_tahun,guru_51_55_tahun,guru_lebih_dari_55_tahun,guru_laki_laki,guru_perempuan
Sumatera Barat,Kota Padang Panjang,Padang Panjang Barat,https://sekolah.data.kemdikbud.go.id/index.php/Chome/profil/19B6C027-CC4F-42ED-A89B-D372F2E9257B,https://referensi.data.kemdikbud.go.id/pendidikan/npsn/70016338,Akademi Kebidanan Imam Bonjol,70016338,Padangpanjang,PASAR USANG,KEC. PADANG PANJANG BARAT,KOTA PADANG PANJANG,PROV. SUMATERA BARAT,SWASTA,Akademik,"Kementerian Pendidikan, Kebudayaan, Riset, dan Teknologi",,,182DO2008,09-09-2008,,,Silakan Upload SK,,,0,,2.,,075283165,075283165,akbid.ib_padangpanjang@yahoo.com,http,-.475949400000,100.411031800000,0,0,0,0,,,2022/2023-2,,0,0,0,0,0,0,0,0,0,0,0,0,0,0,0,0,0,0,0,0,0,0,0,0,,
Sumatera Barat,Kota Padang Panjang,Padang Panjang Barat,https://sekolah.data.kemdikbud.go.id/index.php/Chome/profil/F8BD342D-8F91-4313-8D45-2B48B5CE7D9A,https://referensi.data.kemdikbud.go.id/pendidikan/npsn/10304970,Akademi Keperawatan Nabila,10304970,Jl. Dr. H. Amarullah No. 1 Bukit Surungan Padang Panjang,TANAH HITAM,KEC. PADANG PANJANG BARAT,KOTA PADANG PANJANG,PROV. SUMATERA BARAT,SWASTA,Akademik,"Kementerian Pendidikan, Kebudayaan, Riset, dan Teknologi",,,0054D2.52007,08-01-2007,,,Silakan Upload SK,,,0 m2,1.,2.,,0752-485510,0752-485510,akpernabilakemahasiswaan@gmail.com,www.akpernabila.ac.id,-.453987200000,100.399180200000,,,,,,,,,,,,,,,,,,,,,,,,,,,,,,,,,,
Sumatera Barat,Kota Padang Panjang,Padang Panjang Barat,https://sekolah.data.kemdikbud.go.id/index.php/Chome/profil/8C8BD83E-3DE2-40E9-A33C-8F3698136F59,https://referensi.data.kemdikbud.go.id/pendidikan/npsn/70018193,Institut Seni Indonesia Padang Panjang,70018193,Jln. Bundo Kanduang No 35 Padangpanjang Sumatera Barat,KEC. PADANG PANJANG BARAT,KOTA PADANG PANJANG,PROV. SUMATERA BARAT,INDONESIA,NEGERI,Institut,"Kementerian Pendidikan, Kebudayaan, Riset, dan Teknologi",Pemerintah Pusat,,60 Tahun 2009,31-12-2009,,,Silakan Upload SK,,,294 m2,1.,2.,,0752-83038,0752-82077,isi@isi-padangpanjang.ac.id,www.isi-padangpanjang.ac.id,-.458821000000,100.403793000000,,,,,,,,,,,,,,,,,,,,,,,,,,,,,,,,,,
Sumatera Barat,Kota Padang Panjang,Padang Panjang Barat,https://sekolah.data.kemdikbud.go.id/index.php/Chome/profil/591E6C27-971F-40CA-BCF6-F4F436FCE4D2,https://referensi.data.kemdikbud.go.id/pendidikan/npsn/10304971,Sekolah Tinggi Seni Indonesia Padang Panjang,10304971,Jalan Bundo Kandung No 35,PASAR BARU,KEC. PADANG PANJANG BARAT,KOTA PADANG PANJANG,PROV. SUMATERA BARAT,NEGERI,Sekolah Tinggi,"Kementerian Pendidikan, Kebudayaan, Riset, dan Teknologi",Pemerintah Pusat,,561999,09-06-1999,,,Silakan Upload SK,,,0 m2,1.,2.,,,,,,,,,,,,,,,,,,,,,,,,,,,,,,,,,,,,,,,,,
Sumatera Barat,Kota Padang Panjang,Padang Panjang Barat,https://sekolah.data.kemdikbud.go.id/index.php/Chome/profil/43C64E3D-DB59-4ACD-975D-54EDDCE92BBF,https://referensi.data.kemdikbud.go.id/pendidikan/npsn/70021146,"STAI YPK Imam Bonjol Padang Panjang, Sumatera Barat",70021146,"Jln. Abdul Hamid Hakim No. 2 Kelurahan Pasar Usang Kota Padang Panjang, Sumatera",PASAR USANG,KEC. PADANG PANJANG BARAT,KOTA PADANG PANJANG,PROV. SUMATERA BARAT,SWASTA,Sekolah Tinggi,"Kementerian Pendidikan, Kebudayaan, Riset, dan Teknologi",,,Nomor 67/Kop.VI/09/2001,07-09-2001,,,Silakan Upload SK,,,0 m2,1.,2.,,(0752) 82042,(0752) 82042,stai.imambonjol@yahoo.com,,,,,,,,,,,,,,,,,,,,,,,,,,,,,,,,,,,,,
Sumatera Barat,Kota Padang Panjang,Padang Panjang Barat,https://sekolah.data.kemdikbud.go.id/index.php/Chome/profil/3B04D83D-6F5C-48B7-BBF1-080C2FC891C2,https://referensi.data.kemdikbud.go.id/pendidikan/npsn/70021515,STIT Diniyyah Puteri Rahmah El-Yunusiyyah Kota Padang Panjang,70021515,"Jl. Abdul Hamid Hakim, No. 30. Padang Panjang, Sumatera Barat",KEC. PADANG PANJANG BARAT,KOTA PADANG PANJANG,PROV. SUMATERA BARAT,INDONESIA,SWASTA,Sekolah Tinggi,"Kementerian Pendidikan, Kebudayaan, Riset, dan Teknologi",,,284 Tahun 1989,28-10-1989,,,Silakan Upload SK,,,0 m2,1.,2.,,(0752)84594,(0752)83554,stitdinput@yahoo.co.id,http,-.461881600000,100.398228400000,,,,,,,,,,,,,,,,,,,,,,,,,,,,,,,,,,
