prov_name,kab_name,kec_name,link_sekolah_kita,link_referensi,nama,npsn,alamat,desa/kelurahan,kecamatan/kota_(ln),kab.-kota/negara_(ln),propinsi/luar_negeri_(ln),status_sekolah,bentuk_pendidikan,kementerian_pembina,naungan,npyp,no._sk._pendirian,tanggal_sk._pendirian,nomor_sk_operasional,tanggal_sk_operasional,file_sk_operasional,tanggal_upload_sk_op.,akreditasi,luas_tanah,akses_internet,akses_internet_2,sumber_listrik,fax,telepon,email,website,lintang,bujur
Sulawesi Utara,Kota Bitung,Ranowulu,https://sekolah.data.kemdikbud.go.id/index.php/Chome/profil/846D5EAF-AC8D-42A3-8394-601C5BCBDBAF,https://referensi.data.kemdikbud.go.id/pendidikan/npsn/40103368,Akademi Maritim Indonesia Bitung,40103368,Jalan Piere Tendean Manembo-nembo,APELA DUA,KEC. RANOWULU,KOTA BITUNG,PROV. SULAWESI UTARA,SWASTA,Akademik,"Kementerian Pendidikan, Kebudayaan, Riset, dan Teknologi",,,92,25-09-1990,,,Silakan Upload SK,,,0 m2,1.,2.,,0438-32-933,0438-30-556,amibtg@yahoo.com,,,
Sulawesi Utara,Kota Bitung,Ranowulu,https://sekolah.data.kemdikbud.go.id/index.php/Chome/profil/09DD139B-0C73-4AD8-8399-6F33E5C79DEE,https://referensi.data.kemdikbud.go.id/pendidikan/npsn/70016834,Akademi Perikanan Bitung,70016834,Jalan Tandurusa Kotak Pos 12/BTG,APELA DUA,KEC. RANOWULU,KOTA BITUNG,PROV. SULAWESI UTARA,NEGERI,Akademik,"Kementerian Pendidikan, Kebudayaan, Riset, dan Teknologi",Pemerintah Pusat,,12/2009,17-07-2009,,,Silakan Upload SK,,,0 m2,1.,2.,,0438 21436,0438 36434,ap_bitung@yahoo.co.id,www.ap-bitung.kkp.go.id,,
Sulawesi Utara,Kota Bitung,Ranowulu,https://sekolah.data.kemdikbud.go.id/index.php/Chome/profil/719A0499-BAF2-43D1-9DE7-05ACCBE71CAC,https://referensi.data.kemdikbud.go.id/pendidikan/npsn/70019124,Politeknik Kelautan dan Perikanan Bitung,70019124,Jalan Tandurusa Kotak Pos 12/BTG,APELA DUA,KEC. RANOWULU,KOTA BITUNG,PROV. SULAWESI UTARA,NEGERI,Politeknik,"Kementerian Pendidikan, Kebudayaan, Riset, dan Teknologi",Pemerintah Pusat,,55/PERMEN-KP/2014,17-10-2014,,,Silakan Upload SK,,,0 m2,1.,2.,,0438 21436,0438 36434,"politeknikkp_bitung@yahoo,com",www.poltekkp-bitung.ac.id,1.402221900000,124.929600800000
Sulawesi Utara,Kota Bitung,Ranowulu,https://sekolah.data.kemdikbud.go.id/index.php/Chome/profil/3DED6FE8-6634-4B81-A645-7133365BA451,https://referensi.data.kemdikbud.go.id/pendidikan/npsn/70019676,Sekolah Tinggi Bisnis dan Manajemen Dua Saudara,70019676,,KEC. RANOWULU,KOTA BITUNG,PROV. SULAWESI UTARA,INDONESIA,SWASTA,Sekolah Tinggi,"Kementerian Pendidikan, Kebudayaan, Riset, dan Teknologi",,,5/E/O2014,22-04-2014,,,Silakan Upload SK,,,0 m2,1.,2.,,,+6282189065085,admin@stbmduasudara.ac.id,http,1.626813900000,125.281163300000
Sulawesi Utara,Kota Bitung,Ranowulu,https://sekolah.data.kemdikbud.go.id/index.php/Chome/profil/234F4AED-3B15-4D0F-8E0B-CBA07C47BA85,https://referensi.data.kemdikbud.go.id/pendidikan/npsn/40103371,Sekolah Tinggi Ilmu Ekonomi Petra,40103371,Jalan Manembo Nembo,KEC. RANOWULU,KOTA BITUNG,PROV. SULAWESI UTARA,INDONESIA,SWASTA,Sekolah Tinggi,"Kementerian Pendidikan, Kebudayaan, Riset, dan Teknologi",,,65DO98,11-11-1998,,,Silakan Upload SK,,,0 m2,1.,2.,,,,,,1.430751000000,125.112706000000
Sulawesi Utara,Kota Bitung,Ranowulu,https://sekolah.data.kemdikbud.go.id/index.php/Chome/profil/1DFC3221-A721-4612-99E5-9C2F0E09A546,https://referensi.data.kemdikbud.go.id/pendidikan/npsn/40103373,STMIK Samudra Bitung,40103373,Jalan Babe Palar No 141,APELA DUA,KEC. RANOWULU,KOTA BITUNG,PROV. SULAWESI UTARA,SWASTA,Sekolah Tinggi,"Kementerian Pendidikan, Kebudayaan, Riset, dan Teknologi",,,72D02003,04-07-2002,,,Silakan Upload SK,,,0 m2,1.,2.,,,,,,,
Sulawesi Utara,Kota Bitung,Ranowulu,https://sekolah.data.kemdikbud.go.id/index.php/Chome/profil/FF109C14-8EA3-4954-ACC0-977D0E961143,https://referensi.data.kemdikbud.go.id/pendidikan/npsn/70021833,STT Rumah Murid Kristus Bitung,70021833,Jl. Raya Bitung-Likupang Kel. Dua Sudara,APELA DUA,KEC. RANOWULU,KOTA BITUNG,PROV. SULAWESI UTARA,SWASTA,Sekolah Tinggi,"Kementerian Pendidikan, Kebudayaan, Riset, dan Teknologi",,,DJ.III/Kep/HK.00.5/217/2014,25-07-2014,,,Silakan Upload SK,,,0 m2,1.,2.,,,+6285256317525,STT-RMK@gmail.com,,,
Sulawesi Utara,Kota Bitung,Ranowulu,https://sekolah.data.kemdikbud.go.id/index.php/Chome/profil/A6C2D7BE-6841-47F7-8678-F45E052CDDCA,https://referensi.data.kemdikbud.go.id/pendidikan/npsn/70021837,STT Seapin Filadelfia Pinangunian Bitung,70021837,"Kelurahan Manembo-nembo tengah, Lingk IV, kec Matuari,",KUMERSOT,KEC. RANOWULU,KOTA BITUNG,PROV. SULAWESI UTARA,SWASTA,Sekolah Tinggi,"Kementerian Pendidikan, Kebudayaan, Riset, dan Teknologi",,,,,,,Silakan Upload SK,,,0 m2,1.,2.,,,,,,,
