prov_name,kab_name,kec_name,link_sekolah_kita,link_referensi,nama,npsn,alamat,desa/kelurahan,kecamatan/kota_(ln),kab.-kota/negara_(ln),propinsi/luar_negeri_(ln),status_sekolah,bentuk_pendidikan,kementerian_pembina,naungan,npyp,no._sk._pendirian,tanggal_sk._pendirian,nomor_sk_operasional,tanggal_sk_operasional,file_sk_operasional,tanggal_upload_sk_op.,akreditasi,luas_tanah,akses_internet,akses_internet_2,sumber_listrik,fax,telepon,email,website,lintang,bujur
Sulawesi Selatan,Kab. Maros,Mandai,https://sekolah.data.kemdikbud.go.id/index.php/Chome/profil/FF2155F7-5AE8-4860-AD50-8B1CA85CA9E6,https://referensi.data.kemdikbud.go.id/pendidikan/npsn/40310849,Akademi Kebidanan Salewangan Maros,40310849,Jalan Poros Makassar - Maros,KEC. MANDAI,KAB. MAROS,PROV. SULAWESI SELATAN,INDONESIA,SWASTA,Akademik,"Kementerian Pendidikan, Kebudayaan, Riset, dan Teknologi",,,160DO2002,08-02-2002,,,Silakan Upload SK,,,0 m2,1.,2.,,,,,,,
Sulawesi Selatan,Kab. Maros,Mandai,https://sekolah.data.kemdikbud.go.id/index.php/Chome/profil/E586A51B-039F-42A9-A9CB-02F755C87B18,https://referensi.data.kemdikbud.go.id/pendidikan/npsn/40310850,Akademi Keperawatan Yapenas 21 Maros,40310850,Jl Perintis Kemerdekaan KM 19 Mandai,TENRIGANGKAE,KEC. MANDAI,KAB. MAROS,PROV. SULAWESI SELATAN,SWASTA,Akademik,"Kementerian Pendidikan, Kebudayaan, Riset, dan Teknologi",,,16  38,15-03-2001,,,Silakan Upload SK,,,8.500 m2,1.,2.,,0411-3881920,0411-3881920,info@yapenas21maros.ac.id,http,-6.196849200000,120.447178900000
Sulawesi Selatan,Kab. Maros,Mandai,https://sekolah.data.kemdikbud.go.id/index.php/Chome/profil/4573BBD1-20BA-4FBD-83C1-B3F57C753E25,https://referensi.data.kemdikbud.go.id/pendidikan/npsn/70018252,Institut Teknologi dan Kesehatan Permata Ilmu Maros,70018252,,KEC. MANDAI,KAB. MAROS,PROV. SULAWESI SELATAN,INDONESIA,SWASTA,Institut,"Kementerian Pendidikan, Kebudayaan, Riset, dan Teknologi",,,889/M/2020,21-09-2020,,,Silakan Upload SK,,,0 m2,1.,2.,,,,itkpermatailmumaros@gmail.com,itkpi.ac.id,-5.015253100000,119.567694600000
Sulawesi Selatan,Kab. Maros,Mandai,https://sekolah.data.kemdikbud.go.id/index.php/Chome/profil/687A163F-A649-4FC0-9837-97E473C46CD0,https://referensi.data.kemdikbud.go.id/pendidikan/npsn/70020099,Sekolah Tinggi Ilmu Kesehatan Salewangang Maros,70020099,Jalan Poros Makassar-Maros Telp.0411 3882110,KEC. MANDAI,KAB. MAROS,PROV. SULAWESI SELATAN,INDONESIA,SWASTA,Sekolah Tinggi,"Kementerian Pendidikan, Kebudayaan, Riset, dan Teknologi",,,585/E/O/2014,17-10-2014,,,Silakan Upload SK,,,0 m2,1.,2.,,0411-8938017,0411-8938017,stikessalewangang@yahoo.co.id,,,
Sulawesi Selatan,Kab. Maros,Mandai,https://sekolah.data.kemdikbud.go.id/index.php/Chome/profil/C32344D0-551B-427A-BF2E-738E950BA9FD,https://referensi.data.kemdikbud.go.id/pendidikan/npsn/70020963,"STAI DDI Maros, Sulawesi Selatan",70020963,Jl. Rajawali Baniaga Kel. Taroada Kec. Turikale Kab. Maros,BONTOA,KEC. MANDAI,KAB. MAROS,PROV. SULAWESI SELATAN,SWASTA,Sekolah Tinggi,"Kementerian Pendidikan, Kebudayaan, Riset, dan Teknologi",,,284 Tahun 1995,30-06-1995,,,Silakan Upload SK,,,8.600 m2,1.,2.,,04113881945,04113881945,info@staiddimaros.ac.id,www.staiddimaros.ac.id,-4.920593300000,119.568747000000
