prov_name,kab_name,kec_name,link_sekolah_kita,link_referensi,nama,npsn,alamat,desa/kelurahan,kecamatan/kota_(ln),kab.-kota/negara_(ln),propinsi/luar_negeri_(ln),status_sekolah,bentuk_pendidikan,kementerian_pembina,naungan,npyp,no._sk._pendirian,tanggal_sk._pendirian,nomor_sk_operasional,tanggal_sk_operasional,file_sk_operasional,tanggal_upload_sk_op.,akreditasi,luas_tanah,akses_internet,akses_internet_2,sumber_listrik,fax,telepon,email,website,lintang,bujur
D.K.I. Jakarta,Kota Jakarta Pusat,Senen,https://sekolah.data.kemdikbud.go.id/index.php/Chome/profil/F9133A9A-5442-4204-A3EA-B8E5F015981E,https://referensi.data.kemdikbud.go.id/pendidikan/npsn/20107749,Akademi Pariwisata Gsp Internasional,20107749,"Gedung Menara Salemba Lt. VI, Jl. Salemba Raya No. 5-5A Jakarta Pusat",KENARI,KEC. SENEN,KOTA JAKARTA PUSAT,PROV. D.K.I. JAKARTA,SWASTA,Akademik,"Kementerian Pendidikan, Kebudayaan, Riset, dan Teknologi",,,114/KPT/I/2017,03-02-2017,,,Silakan Upload SK,,,0 m2,1.,2.,,021 22390240,021 22390239,info@gsp.ac.id,www.gsp-international.com,,
D.K.I. Jakarta,Kota Jakarta Pusat,Senen,https://sekolah.data.kemdikbud.go.id/index.php/Chome/profil/C280680C-F17A-4F1F-9BCF-D91C298C3B1F,https://referensi.data.kemdikbud.go.id/pendidikan/npsn/70016911,Akademi Terapi Wicara,70016911,Jl. Kramat VII No.27 Kel. Kenari Kec. Senen Jakarta Pusat,KRAMAT,KEC. SENEN,KOTA JAKARTA PUSAT,PROV. D.K.I. JAKARTA,SWASTA,Akademik,"Kementerian Pendidikan, Kebudayaan, Riset, dan Teknologi",,,110/KPT/I/2017,03-02-2017,,,Silakan Upload SK,,,0 m2,1.,2.,,0213140636,,atw@atw-ybw.ac.id,atw-ybw.ac.id,106.843177000000,6.189554000000
D.K.I. Jakarta,Kota Jakarta Pusat,Senen,https://sekolah.data.kemdikbud.go.id/index.php/Chome/profil/BB28C8F3-7C8F-4D0A-821B-D9F782B75767,https://referensi.data.kemdikbud.go.id/pendidikan/npsn/20107809,Sekolah Tinggi Ilmu Ekonomi Gandhi,20107809,Jalan Pasar Baru Selatan No 10,PASEBAN,KEC. SENEN,KOTA JAKARTA PUSAT,PROV. D.K.I. JAKARTA,SWASTA,Sekolah Tinggi,"Kementerian Pendidikan, Kebudayaan, Riset, dan Teknologi",,,97/M/KPT/I/2019,08-03-2019,,,Silakan Upload SK,,,0 m2,1.,2.,,,,,,,
D.K.I. Jakarta,Kota Jakarta Pusat,Senen,https://sekolah.data.kemdikbud.go.id/index.php/Chome/profil/529DEE9E-1484-463E-86EB-EEBCADA78DCA,https://referensi.data.kemdikbud.go.id/pendidikan/npsn/70019930,Sekolah Tinggi Ilmu Ekonomi Wiyatamandala,70019930,"Cowel Tower Lt. 4, Jl. Senen Raya No. 135",KEC. SENEN,KOTA JAKARTA PUSAT,PROV. D.K.I. JAKARTA,INDONESIA,SWASTA,Sekolah Tinggi,"Kementerian Pendidikan, Kebudayaan, Riset, dan Teknologi",,,41/D/O/2000,17-04-2000,,,Silakan Upload SK,,,0 m2,1.,2.,,021-3511281,021-3866086,admisi@wym.ac.id,wym.ac.id,,
D.K.I. Jakarta,Kota Jakarta Pusat,Senen,https://sekolah.data.kemdikbud.go.id/index.php/Chome/profil/602F3810-86FB-45CB-8DDD-B6CDCD0158CC,https://referensi.data.kemdikbud.go.id/pendidikan/npsn/70020500,Sekolah Tinggi Teologi Eklesia Jakarta,70020500,,SENEN,KEC. SENEN,KOTA JAKARTA PUSAT,PROV. D.K.I. JAKARTA,SWASTA,Sekolah Tinggi,"Kementerian Pendidikan, Kebudayaan, Riset, dan Teknologi",,,534 Tahun 1998,05-10-1998,,,Silakan Upload SK,,,0 m2,1.,2.,,+62 21 3449938,+62 21 3504957,sttekklesiajakarta@gmail.com,http,-6.177323700000,106.840702700000
D.K.I. Jakarta,Kota Jakarta Pusat,Senen,https://sekolah.data.kemdikbud.go.id/index.php/Chome/profil/2BB56449-112A-43A3-8509-6CA3A6AF3E94,https://referensi.data.kemdikbud.go.id/pendidikan/npsn/70021071,STAI Publisistik Thawalib Jakarta,70021071,"-jl. kramat II No. 13, Kwitang Senen, Jakarta Pusat",KRAMAT,KEC. SENEN,KOTA JAKARTA PUSAT,PROV. D.K.I. JAKARTA,SWASTA,Sekolah Tinggi,"Kementerian Pendidikan, Kebudayaan, Riset, dan Teknologi",,,72/E/1987,01-09-1987,,,Silakan Upload SK,,,0 m2,1.,2.,,021 21235235,021 21235235,staithawalib.jkt@gmail.com,https,-6.182566000000,106.841630000000
D.K.I. Jakarta,Kota Jakarta Pusat,Senen,https://sekolah.data.kemdikbud.go.id/index.php/Chome/profil/1A84A9AD-75F9-44CD-BEBA-5A5D23C7F613,https://referensi.data.kemdikbud.go.id/pendidikan/npsn/70022265,Universitas Bina Sarana Informatika,70022265,"Kampus Kramat 98 Jl. Kramat Raya No.98, Senen, Jakarta Pusat 10450tlp. (021) 2",KWITANG,KEC. SENEN,KOTA JAKARTA PUSAT,PROV. D.K.I. JAKARTA,SWASTA,Universitas,"Kementerian Pendidikan, Kebudayaan, Riset, dan Teknologi",,,732/KPT/I/2018,03-09-2018,,,Silakan Upload SK,,,0 m2,1.,2.,,021- 21236158,021 - 23231170,rektorat@bsi.ac.id,https,-6.182874000000,106.842917000000
