prov_name,kab_name,kec_name,link_sekolah_kita,link_referensi,nama,npsn,alamat,desa/kelurahan,kecamatan/kota_(ln),kab.-kota/negara_(ln),propinsi/luar_negeri_(ln),status_sekolah,bentuk_pendidikan,kementerian_pembina,naungan,npyp,no._sk._pendirian,tanggal_sk._pendirian,nomor_sk_operasional,tanggal_sk_operasional,file_sk_operasional,tanggal_upload_sk_op.,akreditasi,luas_tanah,akses_internet,akses_internet_2,sumber_listrik,fax,telepon,email,website,lintang,bujur
Gorontalo,Kota Gorontalo,Kota Barat,https://sekolah.data.kemdikbud.go.id/index.php/Chome/profil/F5F5F84A-4EC7-4C73-ACB4-C2FEE6D7E08E,https://referensi.data.kemdikbud.go.id/pendidikan/npsn/40501609,Akademi Komputer Mall Cendikia,40501609,Jalan Basuki Rahmat No 42,KEC. KOTA BARAT,KOTA GORONTALO,PROV. GORONTALO,INDONESIA,SWASTA,Akademik,"Kementerian Pendidikan, Kebudayaan, Riset, dan Teknologi",,,92D02003,09-06-2003,,,Silakan Upload SK,,,0 m2,1.,2.,,,,,,,
Gorontalo,Kota Gorontalo,Kota Barat,https://sekolah.data.kemdikbud.go.id/index.php/Chome/profil/ABF9DA4D-5E2E-4085-B383-B68C7A49C3EF,https://referensi.data.kemdikbud.go.id/pendidikan/npsn/70017921,IAIN Sultan Amai Gorontalo,70017921,,KEC. KOTA BARAT,KOTA GORONTALO,PROV. GORONTALO,INDONESIA,NEGERI,Institut,"Kementerian Pendidikan, Kebudayaan, Riset, dan Teknologi",Pemerintah Pusat,,Keppres 91 tahun 2004,18-10-2004,,,Silakan Upload SK,,,0 m2,1.,2.,,,(0435) 880251,info@iaingorontalo.ac.id,iaingorontalo.ac.id,.542588700000,123.066735400000
Gorontalo,Kota Gorontalo,Kota Barat,https://sekolah.data.kemdikbud.go.id/index.php/Chome/profil/65A6778C-10BE-4A41-A7AD-182080336239,https://referensi.data.kemdikbud.go.id/pendidikan/npsn/70019752,Sekolah Tinggi Ilmu Administrasi Bina Taruna,70019752,Jl Jaksa Agung Suprapto No 40,KEC. KOTA BARAT,KOTA GORONTALO,PROV. GORONTALO,INDONESIA,SWASTA,Sekolah Tinggi,"Kementerian Pendidikan, Kebudayaan, Riset, dan Teknologi",,,23,09-07-1992,,,Silakan Upload SK,,,0 m2,1.,2.,,(0435)827255,(0435)827255,info@stia.binataruna.ac.id,stia.binataruna.ac.id,,
Gorontalo,Kota Gorontalo,Kota Barat,https://sekolah.data.kemdikbud.go.id/index.php/Chome/profil/53603E24-B48A-4C0E-A48D-00CCB1E6705B,https://referensi.data.kemdikbud.go.id/pendidikan/npsn/70020312,Sekolah Tinggi Manajemen Informatika dan Komputer Ichsan Gorontalo,70020312,Jalan Raden Saleh No 17,KEC. KOTA BARAT,KOTA GORONTALO,PROV. GORONTALO,INDONESIA,SWASTA,Sekolah Tinggi,"Kementerian Pendidikan, Kebudayaan, Riset, dan Teknologi",,,86/D/O/2000,09-06-2000,,,Silakan Upload SK,,,0 m2,1.,2.,,(0435) 831247,,akademik@stmik-ichsan.ac.id,www.stmik-ichsan.ac.id,.555558000000,123.057075000000
Gorontalo,Kota Gorontalo,Kota Barat,https://sekolah.data.kemdikbud.go.id/index.php/Chome/profil/BDE87A73-16D7-43F5-9D87-B5132E166BD4,https://referensi.data.kemdikbud.go.id/pendidikan/npsn/70021305,STIKES Bakti Nusantara Gorontalo,70021305,"Jl. Bali, Kel. Pulubala Kec. Kota Tengah Kota Gorontalo, Provinsi Gorontalo",LEKOBALO,KEC. KOTA BARAT,KOTA GORONTALO,PROV. GORONTALO,SWASTA,Sekolah Tinggi,"Kementerian Pendidikan, Kebudayaan, Riset, dan Teknologi",,,1/E/O/2014,17-04-2014,,,Silakan Upload SK,,,0 m2,1.,2.,,0435-829925,0435-829925,stikesbaktinusantaragorontalo@gmail.com,stikes-baktara.ac.id,.568097100000,123.056246300000
Gorontalo,Kota Gorontalo,Kota Barat,https://sekolah.data.kemdikbud.go.id/index.php/Chome/profil/2432957C-C042-4EA7-857F-B6ED79012B28,https://referensi.data.kemdikbud.go.id/pendidikan/npsn/70022264,Universitas Bina Mandiri Gorontalo,70022264,"Jl. Profesor DR. H. Aloei Saboe, Wongkaditi, Kabila, Kabupaten Bone Bolango, Gor",LEKOBALO,KEC. KOTA BARAT,KOTA GORONTALO,PROV. GORONTALO,SWASTA,Universitas,"Kementerian Pendidikan, Kebudayaan, Riset, dan Teknologi",,,1033/KPT/I/2019,18-10-2019,,,Silakan Upload SK,,,21 m2,1.,2.,,0435-831299,0435-834062,ubmgorontalo@ubmg.ac.id,https,.563004000000,123.088882000000
Gorontalo,Kota Gorontalo,Kota Barat,https://sekolah.data.kemdikbud.go.id/index.php/Chome/profil/B8BEF026-DB78-418C-B491-F967493D148C,https://referensi.data.kemdikbud.go.id/pendidikan/npsn/70022266,Universitas Bina Taruna Gorontalo,70022266,,KEC. KOTA BARAT,KOTA GORONTALO,PROV. GORONTALO,INDONESIA,SWASTA,Universitas,"Kementerian Pendidikan, Kebudayaan, Riset, dan Teknologi",,,101/E/O/2021,05-04-2021,,,Silakan Upload SK,,,0 m2,1.,2.,,,,,https,.548309000000,123.057187300000
Gorontalo,Kota Gorontalo,Kota Barat,https://sekolah.data.kemdikbud.go.id/index.php/Chome/profil/ED63ABA9-1E07-4012-B278-4CEA8E4424BA,https://referensi.data.kemdikbud.go.id/pendidikan/npsn/40501615,Universitas Ichsan Gorontalo,40501615,Jalan Raden Saleh No 17,KEC. KOTA BARAT,KOTA GORONTALO,PROV. GORONTALO,INDONESIA,SWASTA,Universitas,"Kementerian Pendidikan, Kebudayaan, Riset, dan Teknologi",,,84DO2001,10-07-2001,,,Silakan Upload SK,,,0 m2,1.,2.,,,,,,.555916600000,123.056863500000
Gorontalo,Kota Gorontalo,Kota Barat,https://sekolah.data.kemdikbud.go.id/index.php/Chome/profil/201D15B3-0F58-4A8A-AFEE-2ADB5AA4AB9D,https://referensi.data.kemdikbud.go.id/pendidikan/npsn/40501616,Universitas Negeri Gorontalo,40501616,Jalan Jenderal Sudirman No 6 Kec. Kota Tengah Kel. Wumialo,TENILO,KEC. KOTA BARAT,KOTA GORONTALO,PROV. GORONTALO,NEGERI,Universitas,"Kementerian Pendidikan, Kebudayaan, Riset, dan Teknologi",Pemerintah Pusat,,54,23-06-2004,,,Silakan Upload SK,,,1.156.270 m2,1.,2.,,,,,,.556060000000,123.063338000000
