prov_name,kab_name,kec_name,link_sekolah_kita,link_referensi,nama,npsn,alamat,desa/kelurahan,kecamatan/kota_(ln),kab.-kota/negara_(ln),propinsi/luar_negeri_(ln),status_sekolah,bentuk_pendidikan,kementerian_pembina,naungan,npyp,no._sk._pendirian,tanggal_sk._pendirian,nomor_sk_operasional,tanggal_sk_operasional,file_sk_operasional,tanggal_upload_sk_op.,akreditasi,luas_tanah,akses_internet,akses_internet_2,sumber_listrik,fax,telepon,email,website,lintang,bujur
Jawa Tengah,Kab. Banjarnegara,Susukan,https://sekolah.data.kemdikbud.go.id/index.php/Chome/profil/24A70A73-CB50-4E7C-B441-34946B2498EA,https://referensi.data.kemdikbud.go.id/pendidikan/npsn/70019056,Politeknik Banjarnegara,70019056,Jl Raya Madukara Km 02 Kenteng Banjarnegara,KEC. SUSUKAN,KAB. BANJARNEGARA,PROV. JAWA TENGAH,INDONESIA,SWASTA,Politeknik,"Kementerian Pendidikan, Kebudayaan, Riset, dan Teknologi",,,100DO2008,11-06-2008,,,Silakan Upload SK,,,92.082 m2,1.,2.,,0286-592710,0286-591145,humas@polibara.ac.id,www.polibara.ac.id,-7.379703900000,109.705224000000
Jawa Tengah,Kab. Banjarnegara,Susukan,https://sekolah.data.kemdikbud.go.id/index.php/Chome/profil/54EA46F8-D21C-4669-A738-064EC6AE09D1,https://referensi.data.kemdikbud.go.id/pendidikan/npsn/70019615,Sekolah Tinggi Agama Islam Tanbihul Ghofilin Banjarnegara,70019615,"Jl. Raya Tampomas-Bawang KM. 07, Kabupaten Banjarnegara",KARANGSALAM,KEC. SUSUKAN,KAB. BANJARNEGARA,PROV. JAWA TENGAH,SWASTA,Sekolah Tinggi,"Kementerian Pendidikan, Kebudayaan, Riset, dan Teknologi",,,Nomor 290 Tahun 2019,22-05-2019,,,Silakan Upload SK,,,10.000 m2,1.,2.,,,,staitangho@gmail.com,staitangho.ac.id,-7.401255500000,109.627920200000
Jawa Tengah,Kab. Banjarnegara,Susukan,https://sekolah.data.kemdikbud.go.id/index.php/Chome/profil/9A563B93-C362-43DC-9B85-8A025E796A60,https://referensi.data.kemdikbud.go.id/pendidikan/npsn/20332095,Sekolah Tinggi Ilmu Ekonomi Tamansiswa,20332095,Jalan Mayjen Panjaitan No 29 Banjarnegara,KEC. SUSUKAN,KAB. BANJARNEGARA,PROV. JAWA TENGAH,INDONESIA,SWASTA,Sekolah Tinggi,"Kementerian Pendidikan, Kebudayaan, Riset, dan Teknologi",,,4842DT2006,20-12-2006,,,Silakan Upload SK,,,7.250 m2,1.,2.,,,,,,-7.397950000000,109.696210000000
Jawa Tengah,Kab. Banjarnegara,Susukan,https://sekolah.data.kemdikbud.go.id/index.php/Chome/profil/BB071C6B-8D26-46C7-938D-549812EB7C12,https://referensi.data.kemdikbud.go.id/pendidikan/npsn/70020247,Sekolah Tinggi Ilmu Tarbiyah Tunas Bangsa Banjarnegara Jawa Tengah,70020247,Jalan S. Parman No. 11 RT.001 RW. 07 Kel. Semarang Kecamatan Banjar Negara Kabup,PANERUSAN WETAN,KEC. SUSUKAN,KAB. BANJARNEGARA,PROV. JAWA TENGAH,SWASTA,Sekolah Tinggi,"Kementerian Pendidikan, Kebudayaan, Riset, dan Teknologi",,,Nomor,11-07-2017,,,Silakan Upload SK,,,0 m2,1.,2.,,(0286) 5985903,(0286) 5985903,stittunasbangsa@gmail.com,stitusa.ac.id,-7.396046000000,109.715378000000
Jawa Tengah,Kab. Banjarnegara,Susukan,https://sekolah.data.kemdikbud.go.id/index.php/Chome/profil/15382501-7CF1-4733-A103-1BE1E69D29BD,https://referensi.data.kemdikbud.go.id/pendidikan/npsn/70021434,STIMIK Banjarnegara,70021434,,KEC. SUSUKAN,KAB. BANJARNEGARA,PROV. JAWA TENGAH,INDONESIA,SWASTA,Sekolah Tinggi,"Kementerian Pendidikan, Kebudayaan, Riset, dan Teknologi",,,187/M/KPT/2019,18-06-2019,,,Silakan Upload SK,,,0 m2,1.,2.,,,,,,,
Jawa Tengah,Kab. Banjarnegara,Susukan,https://sekolah.data.kemdikbud.go.id/index.php/Chome/profil/8157CB07-E0E1-4682-9E3C-3537ECDC9524,https://referensi.data.kemdikbud.go.id/pendidikan/npsn/70021438,STIMIK Tunas Bangsa Banjarnegara,70021438,Jalan Kali Semi No 9-11 Parakancanggah,KARANGJATI,KEC. SUSUKAN,KAB. BANJARNEGARA,PROV. JAWA TENGAH,SWASTA,Sekolah Tinggi,"Kementerian Pendidikan, Kebudayaan, Riset, dan Teknologi",,,20DO2005,03-03-2005,,,Silakan Upload SK,,,0 m2,1.,2.,,,(0286)5985903,info@stb.ac.id,stb.ac.id,-7.396073000000,109.715215000000
