prov_name,kab_name,kec_name,link_sekolah_kita,link_referensi,nama,npsn,alamat,desa/kelurahan,kecamatan/kota_(ln),kab.-kota/negara_(ln),propinsi/luar_negeri_(ln),status_sekolah,bentuk_pendidikan,kementerian_pembina,naungan,npyp,no._sk._pendirian,tanggal_sk._pendirian,nomor_sk_operasional,tanggal_sk_operasional,file_sk_operasional,tanggal_upload_sk_op.,akreditasi,luas_tanah,akses_internet,akses_internet_2,sumber_listrik,fax,telepon,email,website,lintang,bujur
Jawa Barat,Kab. Garut,Tarogong Kidul,https://sekolah.data.kemdikbud.go.id/index.php/Chome/profil/08CCF290-6320-4D16-B0B2-CF43A67B231E,https://referensi.data.kemdikbud.go.id/pendidikan/npsn/70016347,Akademi Kebidanan Karsa Husada Garut,70016347,"Jl Nusa Indah No.24, Tarogong Kidul, Garut",SUKAJAYA,KEC. TAROGONG KIDUL,KAB. GARUT,PROV. JAWA BARAT,SWASTA,Akademik,"Kementerian Pendidikan, Kebudayaan, Riset dan Teknologi",,,67/D/O/2006,15-05-2006,,,Silakan Upload SK,,,0 m2,1.,2.,,,,,,,
Jawa Barat,Kab. Garut,Tarogong Kidul,https://sekolah.data.kemdikbud.go.id/index.php/Chome/profil/666377C0-FDD1-4D04-ACF2-AA53D203AD5A,https://referensi.data.kemdikbud.go.id/pendidikan/npsn/20238076,Akademi Kebidanan YPSDMI,20238076,Jalan Hasan Arief No 2 Kecamatan Tarogong,JAYAWARAS,KEC. TAROGONG KIDUL,KAB. GARUT,PROV. JAWA BARAT,SWASTA,Akademik,"Kementerian Pendidikan, Kebudayaan, Riset dan Teknologi",,,258DT2007,12-02-2007,,,Silakan Upload SK,,,0 m2,1.,2.,,,,,,,
Jawa Barat,Kab. Garut,Tarogong Kidul,https://sekolah.data.kemdikbud.go.id/index.php/Chome/profil/0FD3D08A-9081-4DEA-A93D-F0BA17E60620,https://referensi.data.kemdikbud.go.id/pendidikan/npsn/70018170,Institut Pendidikan Indonesia Garut,70018170,Jalan Pahlawan Sukagalih No 32 Tarogong - Garut,JAYAWARAS,KEC. TAROGONG KIDUL,KAB. GARUT,PROV. JAWA BARAT,SWASTA,Institut,"Kementerian Pendidikan, Kebudayaan, Riset dan Teknologi",,,653/KPT/I/2017,17-11-2017,,,Silakan Upload SK,,,10.000 m2,1.,2.,,,,info@institutpendidikan.ac.id,https,-7.202630100000,107.882193400000
Jawa Barat,Kab. Garut,Tarogong Kidul,https://sekolah.data.kemdikbud.go.id/index.php/Chome/profil/B53B276C-26D1-49DF-B7C6-1D7E8FB3EE0A,https://referensi.data.kemdikbud.go.id/pendidikan/npsn/20238080,Sekolah Tinggi Ilmu Ekonomi Yasa Anggana,20238080,Jln. Oto Iskadardinata No 278-A Tarogong,JAYARAGA,KEC. TAROGONG KIDUL,KAB. GARUT,PROV. JAWA BARAT,SWASTA,Sekolah Tinggi,"Kementerian Pendidikan, Kebudayaan, Riset dan Teknologi",,,639/KPT/I/2017,16-11-2017,,,Silakan Upload SK,,,18.000 m2,1.,2.,,,,,,-7.198729500000,107.887118300000
Jawa Barat,Kab. Garut,Tarogong Kidul,https://sekolah.data.kemdikbud.go.id/index.php/Chome/profil/BC9BA879-5A0E-46FA-8EAE-F8637D1E5B20,https://referensi.data.kemdikbud.go.id/pendidikan/npsn/20238082,Sekolah Tinggi Teknologi Garut,20238082,Jalan Mayor Syamsu No 2 Desa Jayaraga Kecamatan Tarogong Kidul,JAYARAGA,KEC. TAROGONG KIDUL,KAB. GARUT,PROV. JAWA BARAT,SWASTA,Sekolah Tinggi,"Kementerian Pendidikan, Kebudayaan, Riset dan Teknologi",,,39RHSMPK96,18-06-1990,,,Silakan Upload SK,,,0 m2,1.,2.,,,,,,107.894029300000,-7.206509000000
Jawa Barat,Kab. Garut,Tarogong Kidul,https://sekolah.data.kemdikbud.go.id/index.php/Chome/profil/5D0D9D18-833C-4155-8603-3340AB0A82D3,https://referensi.data.kemdikbud.go.id/pendidikan/npsn/70021351,STIKES Karsa Husada Garut,70021351,"Jl Nusa Indah No.24, Tarogong Kidul, Garut",JAYARAGA,KEC. TAROGONG KIDUL,KAB. GARUT,PROV. JAWA BARAT,SWASTA,Sekolah Tinggi,"Kementerian Pendidikan, Kebudayaan, Riset dan Teknologi",,,91DO2008,28-05-2008,,,Silakan Upload SK,,,7.566 m2,1.,2.,,0262 235860,0262-4704803,baak.skhg21@gmail.com,stikeskhg.ac.id,-7.201983500000,107.893142200000
Jawa Barat,Kab. Garut,Tarogong Kidul,https://sekolah.data.kemdikbud.go.id/index.php/Chome/profil/7420C93A-BBCC-4140-8598-2F09B7371EB2,https://referensi.data.kemdikbud.go.id/pendidikan/npsn/20238083,STKIP Garut,20238083,Jalan Pahlawan Sukagalih No 32 Tarogong - Garut,JAYAWARAS,KEC. TAROGONG KIDUL,KAB. GARUT,PROV. JAWA BARAT,SWASTA,Sekolah Tinggi,"Kementerian Pendidikan, Kebudayaan, Riset dan Teknologi",,,633/KPT/I/2017,11-04-1990,,,Silakan Upload SK,,,0 m2,1.,2.,,0262-233556,0262-233556,info@institutpendidikan.ac.id,http,,
Jawa Barat,Kab. Garut,Tarogong Kidul,https://sekolah.data.kemdikbud.go.id/index.php/Chome/profil/B3C264BB-A72E-4183-B583-79FB8B43A0BC,https://referensi.data.kemdikbud.go.id/pendidikan/npsn/20238084,Universitas Garut,20238084,Jalan Raya Samarang No. 52.A Tarogong Kidul,JAYAWARAS,KEC. TAROGONG KIDUL,KAB. GARUT,PROV. JAWA BARAT,SWASTA,Universitas,"Kementerian Pendidikan, Kebudayaan, Riset dan Teknologi",,,173/D/O/1998,21-12-1998,,,Silakan Upload SK,,,38.588 m2,1.,2.,,(0262)544217,(0262)544217,rektorat@uniga.ac.id,https,-7.194327900000,107.881230700000
