prov_name,kab_name,kec_name,link_sekolah_kita,link_referensi,nama,npsn,alamat,desa/kelurahan,kecamatan/kota_(ln),kab.-kota/negara_(ln),propinsi/luar_negeri_(ln),status_sekolah,bentuk_pendidikan,kementerian_pembina,naungan,npyp,no._sk._pendirian,tanggal_sk._pendirian,nomor_sk_operasional,tanggal_sk_operasional,file_sk_operasional,tanggal_upload_sk_op.,akreditasi,luas_tanah,akses_internet,akses_internet_2,sumber_listrik,fax,telepon,email,website,lintang,bujur
Sumatera Selatan,Kota Palembang,Ilir Barat I,https://sekolah.data.kemdikbud.go.id/index.php/Chome/profil/E1079914-A45C-4E1F-AC01-7D73DA70730B,https://referensi.data.kemdikbud.go.id/pendidikan/npsn/70016397,Akademi Kebidanan Nusantara Palembang,70016397,Jl Insp Marzuki No 124 Siring Agung Pakjo,26 ILIR I,KEC. ILIR BARAT I,KOTA PALEMBANG,PROV. SUMATERA SELATAN,SWASTA,Akademik,"Kementerian Pendidikan, Kebudayaan, Riset dan Teknologi",,,66DO2005,19-05-2005,,,Silakan Upload SK,,,0 m2,1.,2.,,,(0711) 715070,akbid_nusantara@yahoo.com,www.akbidnusantara.ac.id,-2.976832000000,104.778853000000
Sumatera Selatan,Kota Palembang,Ilir Barat I,https://sekolah.data.kemdikbud.go.id/index.php/Chome/profil/9DFF1BDD-1EAE-4F77-8223-AEFFFB12AD45,https://referensi.data.kemdikbud.go.id/pendidikan/npsn/70016839,Akademi Perikanan Wachyuni Mandira,70016839,Jalan Infra Modul Ii Jalur 75,DEMANG LEBAR DAUN,KEC. ILIR BARAT I,KOTA PALEMBANG,PROV. SUMATERA SELATAN,SWASTA,Akademik,"Kementerian Pendidikan, Kebudayaan, Riset dan Teknologi",,,276/D/O/2006,27-12-2006,,,Silakan Upload SK,,,0 m2,1.,2.,,(0711) 374772,(0711) 374770-71,agus.martanto@aws.co.id,,,
Sumatera Selatan,Kota Palembang,Ilir Barat I,https://sekolah.data.kemdikbud.go.id/index.php/Chome/profil/D472C889-32D7-4F60-A175-015EB58F0A87,https://referensi.data.kemdikbud.go.id/pendidikan/npsn/70018076,Institut Agama Islam Widya Dharma Palembang,70018076,"Jl. Soekarno Hatta No. 234 Kelurahan Siring Agung, Kecamatan Ilir Barat I, Kota",SIRING AGUNG,KEC. ILIR BARAT I,KOTA PALEMBANG,PROV. SUMATERA SELATAN,SWASTA,Institut,"Kementerian Pendidikan, Kebudayaan, Riset dan Teknologi",,,Nomor 312 Tahun 2019,22-05-2019,,,Silakan Upload SK,,,0 m2,1.,2.,,,,,,,
Sumatera Selatan,Kota Palembang,Ilir Barat I,https://sekolah.data.kemdikbud.go.id/index.php/Chome/profil/522F56B5-9F82-479F-9E07-25ADD5468746,https://referensi.data.kemdikbud.go.id/pendidikan/npsn/10605965,Sekolah Tinggi Ilmu Ekonomi Aprin,10605965,Jalan Baladewa Padang Selasa,DEMANG LEBAR DAUN,KEC. ILIR BARAT I,KOTA PALEMBANG,PROV. SUMATERA SELATAN,SWASTA,Sekolah Tinggi,"Kementerian Pendidikan, Kebudayaan, Riset dan Teknologi",,,049DIKTIKEP1994,03-02-1994,,,Silakan Upload SK,,,0 m2,1.,2.,,,,,,-2.993403300000,104.730077900000
Sumatera Selatan,Kota Palembang,Ilir Barat I,https://sekolah.data.kemdikbud.go.id/index.php/Chome/profil/B578E47E-5858-4BC6-8B99-8BF3E11BC298,https://referensi.data.kemdikbud.go.id/pendidikan/npsn/10605971,Sekolah Tinggi Ilmu Kesehatan Bina Husada,10605971,Jalan Syech Abdul Somad No 28,DEMANG LEBAR DAUN,KEC. ILIR BARAT I,KOTA PALEMBANG,PROV. SUMATERA SELATAN,SWASTA,Sekolah Tinggi,"Kementerian Pendidikan, Kebudayaan, Riset dan Teknologi",,,112DO2000,26-07-2000,,,Silakan Upload SK,,,0 m2,1.,2.,,0711-365533,0711-357378,info@binahusada.ac.id,www.binahusada.ac.id,-28.537759800000,169.204503100000
