prov_name,kab_name,kec_name,link_sekolah_kita,link_referensi,nama,npsn,alamat,desa/kelurahan,kecamatan/kota_(ln),kab.-kota/negara_(ln),propinsi/luar_negeri_(ln),status_sekolah,bentuk_pendidikan,kementerian_pembina,naungan,npyp,no._sk._pendirian,tanggal_sk._pendirian,nomor_sk_operasional,tanggal_sk_operasional,file_sk_operasional,tanggal_upload_sk_op.,akreditasi,luas_tanah,akses_internet,akses_internet_2,sumber_listrik,fax,telepon,email,website,lintang,bujur
Sulawesi Tenggara,Kota Kendari,Baruga,https://sekolah.data.kemdikbud.go.id/index.php/Chome/profil/5F1A813E-5012-44E0-A4A1-BEF6C15A26EE,https://referensi.data.kemdikbud.go.id/pendidikan/npsn/40403050,Akademi Analis Kesehatan Kendari,40403050,Jalan Sorumba No 17 Kendari,BARUGA,KEC. BARUGA,KOTA KENDARI,PROV. SULAWESI TENGGARA,SWASTA,Akademik,"Kementerian Pendidikan, Kebudayaan, Riset dan Teknologi",,,56DO2006,12-04-2006,,,Silakan Upload SK,,,0 m2,1.,2.,,0401-3190-193,0401-3190-193,aakbinhuskdi@yahoo.co.id,http,,
Sulawesi Tenggara,Kota Kendari,Baruga,https://sekolah.data.kemdikbud.go.id/index.php/Chome/profil/614BEB16-8FA2-4F96-B113-F31B47D34238,https://referensi.data.kemdikbud.go.id/pendidikan/npsn/40403052,Akademi Farmasi Bina Husada Kendari,40403052,Jalan Asrama Haji No 17 Baruga,KEC. BARUGA,KOTA KENDARI,PROV. SULAWESI TENGGARA,INDONESIA,SWASTA,Akademik,"Kementerian Pendidikan, Kebudayaan, Riset dan Teknologi",,,899DT2005,09-03-2005,,,Silakan Upload SK,,,0 m2,1.,2.,,,,,,,
Sulawesi Tenggara,Kota Kendari,Baruga,https://sekolah.data.kemdikbud.go.id/index.php/Chome/profil/5DB824BE-DF25-4246-B36F-00FE6E3E3904,https://referensi.data.kemdikbud.go.id/pendidikan/npsn/70016680,Akademi Kesehatan Gigi Kendari,70016680,Jalan Asrama Haji No 17,KEC. BARUGA,KOTA KENDARI,PROV. SULAWESI TENGGARA,INDONESIA,SWASTA,Akademik,"Kementerian Pendidikan, Kebudayaan, Riset dan Teknologi",,,166DO2007,03-09-2007,,,Silakan Upload SK,,,0 m2,1.,2.,,0401-3190193,0401-3190193,akademikesehatangigikendari@gmail.com,,,
Sulawesi Tenggara,Kota Kendari,Baruga,https://sekolah.data.kemdikbud.go.id/index.php/Chome/profil/CCB2EBF1-CC91-457B-B8F3-7449118208A2,https://referensi.data.kemdikbud.go.id/pendidikan/npsn/70018249,Institut Teknologi dan Kesehatan Avicenna,70018249,Jl Y Wayong By Pass Lepo-lepo,KEC. BARUGA,KOTA KENDARI,PROV. SULAWESI TENGGARA,INDONESIA,SWASTA,Institut,"Kementerian Pendidikan, Kebudayaan, Riset dan Teknologi",,,772/KPT/I/2018,13-09-2018,,,Silakan Upload SK,,,25.450 m2,1.,2.,,04013192981,04013192981,itk.avicenna@gmail.com,www.itk-avicenna.ac.id,-3.998319000000,122.594199600000
Sulawesi Tenggara,Kota Kendari,Baruga,https://sekolah.data.kemdikbud.go.id/index.php/Chome/profil/BD4164DC-C8FE-4EC3-A6DC-3F4FD9C4A019,https://referensi.data.kemdikbud.go.id/pendidikan/npsn/40403064,Sekolah Tinggi Ilmu Kesehatan Avicenna,40403064,Jl Y Wayong By Pass Lepo-lepo,KEC. BARUGA,KOTA KENDARI,PROV. SULAWESI TENGGARA,INDONESIA,SWASTA,Sekolah Tinggi,"Kementerian Pendidikan, Kebudayaan, Riset dan Teknologi",,,755/KPT/I/2018,10-09-2018,,,Silakan Upload SK,,,0 m2,1.,2.,,04013192981,04013192981,stikavicenna@yahoo.co.id,www.stik-avicenna.ac.id,4.022379000000,122.503896000000
Sulawesi Tenggara,Kota Kendari,Baruga,https://sekolah.data.kemdikbud.go.id/index.php/Chome/profil/F004EF19-7EDC-41F8-9AB8-1D74E78730D1,https://referensi.data.kemdikbud.go.id/pendidikan/npsn/70022489,Universitas Nahdlatul Ulama Sulawesi Tenggara,70022489,Jl. Mayjen Katamaso No. 2,KEC. BARUGA,KOTA KENDARI,PROV. SULAWESI TENGGARA,INDONESIA,SWASTA,Universitas,"Kementerian Pendidikan, Kebudayaan, Riset dan Teknologi",,,567/E/O/2014,17-10-2014,,,Silakan Upload SK,,,10.000 m2,1.,2.,,,,unusraofficial@gmail.com,pcmb.unusultra.ac.id,-4.046155100000,122.492979100000
