prov_name,kab_name,kec_name,link_sekolah_kita,link_referensi,nama,npsn,alamat,desa/kelurahan,kecamatan/kota_(ln),kab.-kota/negara_(ln),propinsi/luar_negeri_(ln),status_sekolah,bentuk_pendidikan,kementerian_pembina,naungan,npyp,no._sk._pendirian,tanggal_sk._pendirian,nomor_sk_operasional,tanggal_sk_operasional,file_sk_operasional,tanggal_upload_sk_op.,akreditasi,luas_tanah,akses_internet,akses_internet_2,sumber_listrik,fax,telepon,email,website,lintang,bujur
Jawa Barat,Kab. Bandung Barat,Rongga,https://sekolah.data.kemdikbud.go.id/index.php/Chome/profil/83642CB9-6719-4CB7-A2DB-E69C258D8827,https://referensi.data.kemdikbud.go.id/pendidikan/npsn/70016470,Akademi Kebidanan Tri Dharma Husada Bandung,70016470,Jl Raya Barat Cimahi No 817,KEC. RONGGA,KAB. BANDUNG BARAT,PROV. JAWA BARAT,INDONESIA,SWASTA,Akademik,"Kementerian Pendidikan, Kebudayaan, Riset dan Teknologi",,,137DO2005,27-09-2005,,,Silakan Upload SK,,,0 m2,1.,2.,,022-6620725,022-70723139,akbid_tdh@yahoo.co.id,www.akbidtdh.ac.id,,
Jawa Barat,Kab. Bandung Barat,Rongga,https://sekolah.data.kemdikbud.go.id/index.php/Chome/profil/7FA14F20-CC7C-4CFE-89C5-A85BAB94360E,https://referensi.data.kemdikbud.go.id/pendidikan/npsn/70019660,Sekolah Tinggi Alkitab Tiranus Bandung,70019660,"Jl. Cihanjuang Km. 5.2 Desa Cihanjuang, Kec Parongpong, Kab bandung Barat",CICADAS,KEC. RONGGA,KAB. BANDUNG BARAT,PROV. JAWA BARAT,SWASTA,Sekolah Tinggi,"Kementerian Pendidikan, Kebudayaan, Riset dan Teknologi",,,,,,,Silakan Upload SK,,,25.000 m2,1.,2.,,022-6658353,022-6658354,stat@tiranus.ac.id,tiranus.ac.id,-6.840720400000,107.573648500000
Jawa Barat,Kab. Bandung Barat,Rongga,https://sekolah.data.kemdikbud.go.id/index.php/Chome/profil/56E916B2-7FA8-4EFF-A07B-DAC56CE5EB73,https://referensi.data.kemdikbud.go.id/pendidikan/npsn/70019685,Sekolah Tinggi Ekonomi Bisnis Islam Bina Essa,70019685,"Jl. Cihanjuang KM. 2,45 Kabupaten Bandung Barat, Provinsi Jawa Barat",CIBEDUG,KEC. RONGGA,KAB. BANDUNG BARAT,PROV. JAWA BARAT,SWASTA,Sekolah Tinggi,"Kementerian Pendidikan, Kebudayaan, Riset dan Teknologi",,,Nomor 305 Tahun 2019,22-05-2019,,,Silakan Upload SK,,,0 m2,1.,2.,,,,infostebi@gmail.com,stebibinaessa.sch.id,,
Jawa Barat,Kab. Bandung Barat,Rongga,https://sekolah.data.kemdikbud.go.id/index.php/Chome/profil/9AFB0A93-75B9-4E2A-8BEB-A23F658D02E0,https://referensi.data.kemdikbud.go.id/pendidikan/npsn/70019710,Sekolah Tinggi Ekonomi Islam (STEI) LPPM,70019710,Jl. GA Manulang Komplek PPI No. 132Padalarang - Kabupaten Bandung BaratJawa,KEC. RONGGA,KAB. BANDUNG BARAT,PROV. JAWA BARAT,INDONESIA,SWASTA,Sekolah Tinggi,"Kementerian Pendidikan, Kebudayaan, Riset dan Teknologi",,,779 Tahun 2013,03-04-2013,,,Silakan Upload SK,,,0 m2,1.,2.,,,022-6864385,steilppm@yahoo.co.id,www.stei-lppm.ac.id,-6.857331800000,107.498849600000
Jawa Barat,Kab. Bandung Barat,Rongga,https://sekolah.data.kemdikbud.go.id/index.php/Chome/profil/5B6B7CFF-EB4A-47DF-AFA9-CFE2AB4AF51B,https://referensi.data.kemdikbud.go.id/pendidikan/npsn/70020592,Sekolah Tinggi Teologi Misi Tuaian Semesta Bandung,70020592,"Jl. Kolonel Masturi No. 661 Ds. Jambudipa, Kec. Cisarua",SUKARESMI,KEC. RONGGA,KAB. BANDUNG BARAT,PROV. JAWA BARAT,SWASTA,Sekolah Tinggi,"Kementerian Pendidikan, Kebudayaan, Riset dan Teknologi",,,,,,,Silakan Upload SK,,,0 m2,1.,2.,,022 2700367,022 2700278,sttmisituaiansemesta@gmail.com,,-6.838731500000,107.552461900000
Jawa Barat,Kab. Bandung Barat,Rongga,https://sekolah.data.kemdikbud.go.id/index.php/Chome/profil/F6DAE3AA-0F5A-4F65-A397-90FAAEAFA80B,https://referensi.data.kemdikbud.go.id/pendidikan/npsn/70020595,Sekolah Tinggi Teologi Mitra,70020595,"Jl. Raya Purwakarta, KM. 12,5, Kampung Cirangrang, Kabupaten Bandung, Jawa Barat",KEC. RONGGA,KAB. BANDUNG BARAT,PROV. JAWA BARAT,INDONESIA,SWASTA,Sekolah Tinggi,"Kementerian Pendidikan, Kebudayaan, Riset dan Teknologi",,,DJ.III/Kep/HK.00.5/627/2014,31-12-2014,,,Silakan Upload SK,,,0 m2,1.,2.,,,,stt.mitra@yahoo.com,sttmitra.ac.id,-7.767098200000,111.306553900000
Jawa Barat,Kab. Bandung Barat,Rongga,https://sekolah.data.kemdikbud.go.id/index.php/Chome/profil/69CBB49B-0715-4117-BFB7-E305D6864E57,https://referensi.data.kemdikbud.go.id/pendidikan/npsn/70020944,STAI Darul Falah Cililin Cihampelas Bandung Barat,70020944,Jl. Cihampelas No. 96 RT 5 RW 2 Ds. Cihampelas Kec. Cihampelas Kab. Bandung Bara,CICADAS,KEC. RONGGA,KAB. BANDUNG BARAT,PROV. JAWA BARAT,SWASTA,Sekolah Tinggi,"Kementerian Pendidikan, Kebudayaan, Riset dan Teknologi",,,Dj.I/35/2008,30-01-2008,,,Silakan Upload SK,,,400.000 m2,1.,2.,,0226864190,02286861757,staidaf2001@gmail.com,staidaf.ac.id,,
Jawa Barat,Kab. Bandung Barat,Rongga,https://sekolah.data.kemdikbud.go.id/index.php/Chome/profil/29E76C97-BF74-424C-9EE6-27DCDE87F13A,https://referensi.data.kemdikbud.go.id/pendidikan/npsn/20238257,Universitas Advent Indonesia,20238257,"Jl Kolonel Masturi KM 3,5 Parongpong",SUKARESMI,KEC. RONGGA,KAB. BANDUNG BARAT,PROV. JAWA BARAT,SWASTA,Universitas,"Kementerian Pendidikan, Kebudayaan, Riset dan Teknologi",,,NO 38,23-03-1985,,,Silakan Upload SK,,,0 m2,1.,2.,,,,,,-6.801884400000,107.578511200000
