prov_name,kab_name,kec_name,link_sekolah_kita,link_referensi,nama,npsn,alamat,desa/kelurahan,kecamatan/kota_(ln),kab.-kota/negara_(ln),propinsi/luar_negeri_(ln),status_sekolah,bentuk_pendidikan,kementerian_pembina,naungan,npyp,no._sk._pendirian,tanggal_sk._pendirian,nomor_sk_operasional,tanggal_sk_operasional,file_sk_operasional,tanggal_upload_sk_op.,akreditasi,luas_tanah,akses_internet,akses_internet_2,sumber_listrik,fax,telepon,email,website,lintang,bujur
Bengkulu,Kota Bengkulu,Selebar,https://sekolah.data.kemdikbud.go.id/index.php/Chome/profil/8DF3E83E-D125-49CC-AAEA-862F737B6155,https://referensi.data.kemdikbud.go.id/pendidikan/npsn/70016102,Akademi Akuntansi dan Manajemen Pembangunan,70016102,,KEC. SELEBAR,KOTA BENGKULU,PROV. BENGKULU,INDONESIA,SWASTA,Akademik,"Kementerian Pendidikan, Kebudayaan, Riset dan Teknologi",,,999/M/2020,09-11-2020,,,Silakan Upload SK,,,0 m2,1.,2.,,,,aamprb19@gmail.com,www.aampbkl.com,-3.871587100000,102.313351000000
Bengkulu,Kota Bengkulu,Selebar,https://sekolah.data.kemdikbud.go.id/index.php/Chome/profil/FF1654FF-1A9A-41B6-BFBA-DD5B83BB6119,https://referensi.data.kemdikbud.go.id/pendidikan/npsn/10702743,Akademi Analis Kesehatan Harapan Bangsa,10702743,Jl RAYA DEPATI PAYUNG NEGARA no. 16 A  PADANG KEMILING KOTA BENGKULU,KEC. SELEBAR,KOTA BENGKULU,PROV. BENGKULU,INDONESIA,SWASTA,Akademik,"Kementerian Pendidikan, Kebudayaan, Riset dan Teknologi",,,200DO2002,04-09-2002,,,Silakan Upload SK,,,3.411 m2,1.,2.,,,,,,-3.856134100000,102.337345500000
Bengkulu,Kota Bengkulu,Selebar,https://sekolah.data.kemdikbud.go.id/index.php/Chome/profil/FF83D5D8-B082-44FE-8320-8DE1E3DE97A0,https://referensi.data.kemdikbud.go.id/pendidikan/npsn/70016205,Akademi Farmasi Yayasan Al-Fatah,70016205,AKADEMI FARMASI AL-FATAH BENGKULU,SUKA RAMI,KEC. SELEBAR,KOTA BENGKULU,PROV. BENGKULU,SWASTA,Akademik,"Kementerian Pendidikan, Kebudayaan, Riset dan Teknologi",,,73DO2008,18-04-2008,,,Silakan Upload SK,,,0 m2,1.,2.,,0736-27508,0736-27508,info@akfar-alfatah.ac.id,www.akfar-alfatah.ac.id,-3.814040000000,102.282754000000
Bengkulu,Kota Bengkulu,Selebar,https://sekolah.data.kemdikbud.go.id/index.php/Chome/profil/3AB39B6C-89AD-465D-8483-9A440580653F,https://referensi.data.kemdikbud.go.id/pendidikan/npsn/70016304,Akademi Kebidanan Dehasen Bengkulu,70016304,Jl. Merapi Raya No. 43 Kel. Kebun Tebeng Kec. Ratu Agung Kota Bengkulu,PEKAN SABTU,KEC. SELEBAR,KOTA BENGKULU,PROV. BENGKULU,SWASTA,Akademik,"Kementerian Pendidikan, Kebudayaan, Riset dan Teknologi",,,140D02008,13-07-2008,,,Silakan Upload SK,,,0 m2,1.,2.,,(0736)20598,(0736)21977,akbid.dehasen@yahoo.co.id,www.akbiddehasen.web.id,,
Bengkulu,Kota Bengkulu,Selebar,https://sekolah.data.kemdikbud.go.id/index.php/Chome/profil/4C472173-0D87-43A9-AE2C-A96E697C63DE,https://referensi.data.kemdikbud.go.id/pendidikan/npsn/70016422,Akademi Kebidanan Pemprov Bengkulu,70016422,jalan indra giri no 4 padang harapan bengkulu,KEC. SELEBAR,KOTA BENGKULU,PROV. BENGKULU,INDONESIA,SWASTA,Akademik,"Kementerian Pendidikan, Kebudayaan, Riset dan Teknologi",Pemerintah Daerah,,354/E/O/2012,10-10-2012,,,Silakan Upload SK,,,0 m2,1.,2.,,0736-21118,0736-20655,devadeden61@yahoo.co.id,poltekkes-provinsi-bengkulu.ac.id,,
Bengkulu,Kota Bengkulu,Selebar,https://sekolah.data.kemdikbud.go.id/index.php/Chome/profil/46CFD660-CADA-461D-8AC2-96A17B4E0A56,https://referensi.data.kemdikbud.go.id/pendidikan/npsn/70016624,Akademi Keperawatan Pemprov Bengkulu,70016624,jalan indra giri no. 4 padang harapan,KEC. SELEBAR,KOTA BENGKULU,PROV. BENGKULU,INDONESIA,SWASTA,Akademik,"Kementerian Pendidikan, Kebudayaan, Riset dan Teknologi",Pemerintah Daerah,,354/E/O/2012,10-10-2012,,,Silakan Upload SK,,,0 m2,1.,2.,,0736-21118,0736-20655,devadeden61@yahoo.co.id,poltekkes-provinsi-bengkulu.icid,,
Bengkulu,Kota Bengkulu,Selebar,https://sekolah.data.kemdikbud.go.id/index.php/Chome/profil/67DCCC3B-84CC-49DB-83DD-582FCB4BC707,https://referensi.data.kemdikbud.go.id/pendidikan/npsn/70016697,Akademi Kesehatan Yayasan Sapta Bakti Bengkulu,70016697,Bengkulu,BETUNGAN,KEC. SELEBAR,KOTA BENGKULU,PROV. BENGKULU,SWASTA,Akademik,"Kementerian Pendidikan, Kebudayaan, Riset dan Teknologi",,,108DO2008,25-06-2008,,,Silakan Upload SK,,,0 m2,1.,2.,,(0736)346300,(0736)346300,sapta_bakti@yahoo.co.id,www.saptabakti.ac.id,,
Bengkulu,Kota Bengkulu,Selebar,https://sekolah.data.kemdikbud.go.id/index.php/Chome/profil/CD12B658-34BF-4309-A8D6-421BCA4CEC03,https://referensi.data.kemdikbud.go.id/pendidikan/npsn/70017905,IAIN Bengkulu,70017905,"Jl.Raden Fatah Pagar Dewa, Air sebakul",PAGAR DEWA,KEC. SELEBAR,KOTA BENGKULU,PROV. BENGKULU,NEGERI,Institut,"Kementerian Pendidikan, Kebudayaan, Riset dan Teknologi",Pemerintah Pusat,,PP NO.51 TAHUN 2012,25-04-2012,,,Silakan Upload SK,,,0 m2,1.,2.,,0736-51171,0736-51276,iainbengkulu@iainbengkulu.ac.id,http,-3.834025000000,102.327613000000
Bengkulu,Kota Bengkulu,Selebar,https://sekolah.data.kemdikbud.go.id/index.php/Chome/profil/D60157F8-103C-4192-BFF9-20383F77934A,https://referensi.data.kemdikbud.go.id/pendidikan/npsn/10702745,Sekolah Tinggi Ilmu Administrasi Bengkulu,10702745,"Jalan Cimanuk Km 6,5 Kelurahan Jalan Gedang Kecamatan Gading CempakaKota Bengk",KEC. SELEBAR,KOTA BENGKULU,PROV. BENGKULU,INDONESIA,SWASTA,Sekolah Tinggi,"Kementerian Pendidikan, Kebudayaan, Riset dan Teknologi",,,2030DT2006,21-06-2006,,,Silakan Upload SK,,,0 m2,1.,2.,,0736-22309,0736-22309,stiabengkulu@yahoo.co.id,http;//www.stiabengkulu.ac.id,-3.819667000000,102.291862000000
Bengkulu,Kota Bengkulu,Selebar,https://sekolah.data.kemdikbud.go.id/index.php/Chome/profil/48ADA569-CD6A-4A99-A675-01B0C2E54828,https://referensi.data.kemdikbud.go.id/pendidikan/npsn/70019919,Sekolah Tinggi Ilmu Ekonomi Syariah Nahdlatul Ulama Bengkulu,70019919,,KEC. SELEBAR,KOTA BENGKULU,PROV. BENGKULU,INDONESIA,SWASTA,Sekolah Tinggi,"Kementerian Pendidikan, Kebudayaan, Riset dan Teknologi",,,Nomor,01-02-2016,,,Silakan Upload SK,,,0 m2,1.,2.,,,,humas@stiesnu-bengkulu.ac.id,stiesnu-bengkulu.ac.id,-3.846857000000,102.328555000000
Bengkulu,Kota Bengkulu,Selebar,https://sekolah.data.kemdikbud.go.id/index.php/Chome/profil/C1F16C76-7C13-4379-BB83-3F77B38E0AB9,https://referensi.data.kemdikbud.go.id/pendidikan/npsn/70020104,Sekolah Tinggi Ilmu Kesehatan Sapta Bakti,70020104,,KEC. SELEBAR,KOTA BENGKULU,PROV. BENGKULU,INDONESIA,SWASTA,Sekolah Tinggi,"Kementerian Pendidikan, Kebudayaan, Riset dan Teknologi",,,515/M/2020,08-05-2020,,,Silakan Upload SK,,,0 m2,1.,2.,,,0736-346300,sapta_bakti@yahoo.co.id,,-3.839925600000,102.308111500000
Bengkulu,Kota Bengkulu,Selebar,https://sekolah.data.kemdikbud.go.id/index.php/Chome/profil/BF75670E-B96D-4A47-94B0-D7A9002803BF,https://referensi.data.kemdikbud.go.id/pendidikan/npsn/10702747,Sekolah Tinggi Ilmu Teknik Trisula,10702747,Jl.M.Hasan 3 No.3 Pasar Baru Telp 0736 348 512 Bengkulu 38114,PEKAN SABTU,KEC. SELEBAR,KOTA BENGKULU,PROV. BENGKULU,SWASTA,Sekolah Tinggi,"Kementerian Pendidikan, Kebudayaan, Riset dan Teknologi",,,35,16-02-2001,,,Silakan Upload SK,,,0 m2,1.,2.,,,,,,,
Bengkulu,Kota Bengkulu,Selebar,https://sekolah.data.kemdikbud.go.id/index.php/Chome/profil/C24D9A20-DD13-4221-944C-80B868E87DAD,https://referensi.data.kemdikbud.go.id/pendidikan/npsn/70020291,Sekolah Tinggi Kesehatan Al-Fatah Bengkulu,70020291,,KEC. SELEBAR,KOTA BENGKULU,PROV. BENGKULU,INDONESIA,SWASTA,Sekolah Tinggi,"Kementerian Pendidikan, Kebudayaan, Riset dan Teknologi",,,724/M/2020,05-08-2020,,,Silakan Upload SK,,,15.517 m2,1.,2.,,073627508,073627508,info@stikesalfatah.ac.id,http,-3.814329200000,102.282758300000
Bengkulu,Kota Bengkulu,Selebar,https://sekolah.data.kemdikbud.go.id/index.php/Chome/profil/975023B7-8CBB-48A3-83F4-906D8C87E6B7,https://referensi.data.kemdikbud.go.id/pendidikan/npsn/70020396,Sekolah Tinggi Teknologi Bengkulu,70020396,,KEC. SELEBAR,KOTA BENGKULU,PROV. BENGKULU,INDONESIA,SWASTA,Sekolah Tinggi,"Kementerian Pendidikan, Kebudayaan, Riset dan Teknologi",,,188/KPT/I/2016,13-05-2016,,,Silakan Upload SK,,,0 m2,1.,2.,,,,,,,
Bengkulu,Kota Bengkulu,Selebar,https://sekolah.data.kemdikbud.go.id/index.php/Chome/profil/355EA025-91FB-454F-A389-F60FA8307C8F,https://referensi.data.kemdikbud.go.id/pendidikan/npsn/70020457,Sekolah Tinggi Teologi Arastamar Bengkulu,70020457,,KEC. SELEBAR,KOTA BENGKULU,PROV. BENGKULU,INDONESIA,SWASTA,Sekolah Tinggi,"Kementerian Pendidikan, Kebudayaan, Riset dan Teknologi",,,DJ.III/KEp/HK.00.5/878/2011,30-12-2011,,,Silakan Upload SK,,,3.000 m2,1.,2.,,0736 5611628,0736 5611628,sttabbengkulu@yahoo.co.id,www.sttab.ac.id,-3.834858200000,102.298737800000
Bengkulu,Kota Bengkulu,Selebar,https://sekolah.data.kemdikbud.go.id/index.php/Chome/profil/34209B64-03E2-4AA0-9161-07ABCDB4B69C,https://referensi.data.kemdikbud.go.id/pendidikan/npsn/10702748,STIKES Bhakti Husada Bengkulu,10702748,Jalan Kinibalu 8 Kebun Tebeng Bengkulu,KEC. SELEBAR,KOTA BENGKULU,PROV. BENGKULU,INDONESIA,SWASTA,Sekolah Tinggi,"Kementerian Pendidikan, Kebudayaan, Riset dan Teknologi",,,113DO2003,01-08-2003,,,Silakan Upload SK,,,5.000 m2,1.,2.,,,,,,-3.802195300000,102.283786400000
Bengkulu,Kota Bengkulu,Selebar,https://sekolah.data.kemdikbud.go.id/index.php/Chome/profil/600A6A52-F666-46E1-8BFF-286D14BB2C91,https://referensi.data.kemdikbud.go.id/pendidikan/npsn/10702749,STIKES Tri Mandiri Sakti Bengkulu,10702749,Jalan Hibrida Raya No 3,PAGAR DEWA,KEC. SELEBAR,KOTA BENGKULU,PROV. BENGKULU,SWASTA,Sekolah Tinggi,"Kementerian Pendidikan, Kebudayaan, Riset dan Teknologi",,,147DO2001,30-08-2001,,,Silakan Upload SK,,,1.000 m2,1.,2.,,,,,,-3.828402400000,102.313204000000
Bengkulu,Kota Bengkulu,Selebar,https://sekolah.data.kemdikbud.go.id/index.php/Chome/profil/2E9737D8-547E-453B-96FC-D0BD47398996,https://referensi.data.kemdikbud.go.id/pendidikan/npsn/70022352,Universitas Islam Negeri Fatmawati Sukarno Bengkulu,70022352,Jl. Raden Fatah Kel. Pagar Dewa Kec. Selebar,PAGAR DEWA,KEC. SELEBAR,KOTA BENGKULU,PROV. BENGKULU,NEGERI,Universitas,"Kementerian Pendidikan, Kebudayaan, Riset dan Teknologi",Pemerintah Pusat,,Perpres nomor 45 tahun 2021,11-05-2021,,,Silakan Upload SK,,,0 m2,1.,2.,,0736-51171,0736-51276,admin@uinfasbengkulu.ac.id,,-3.834153200000,102.327711600000
Bengkulu,Kota Bengkulu,Selebar,https://sekolah.data.kemdikbud.go.id/index.php/Chome/profil/283DF265-8541-4825-8DF3-40D4B51D52A7,https://referensi.data.kemdikbud.go.id/pendidikan/npsn/10702753,Universitas Prof Dr Hazairin SH,10702753,Jalan Jenderal Ahmad Yani No 1,PAGAR DEWA,KEC. SELEBAR,KOTA BENGKULU,PROV. BENGKULU,SWASTA,Universitas,"Kementerian Pendidikan, Kebudayaan, Riset dan Teknologi",,,1,16-04-1984,,,Silakan Upload SK,,,0 m2,1.,2.,,0736 20956,0736 20956,unihaz_bengkulu@yahoo.com,unihaz.ac.id,-3.791986000000,102.257020000000
