prov_name,kab_name,kec_name,link_sekolah_kita,link_referensi,nama,npsn,alamat,desa/kelurahan,kecamatan/kota_(ln),kab.-kota/negara_(ln),propinsi/luar_negeri_(ln),status_sekolah,bentuk_pendidikan,kementerian_pembina,naungan,npyp,no._sk._pendirian,tanggal_sk._pendirian,nomor_sk_operasional,tanggal_sk_operasional,file_sk_operasional,tanggal_upload_sk_op.,akreditasi,luas_tanah,akses_internet,akses_internet_2,sumber_listrik,fax,telepon,email,website,lintang,bujur
Jawa Tengah,Kab. Klaten,Prambanan,https://sekolah.data.kemdikbud.go.id/index.php/Chome/profil/78D1DA2A-514F-4E54-BF61-AC0F9F740D74,https://referensi.data.kemdikbud.go.id/pendidikan/npsn/20332112,Akademi Akuntansi Muhammadiyah Klaten,20332112,Jalan Andalas No 1 Semangkak,JOHO,KEC. PRAMBANAN,KAB. KLATEN,PROV. JAWA TENGAH,SWASTA,Akademik,"Kementerian Pendidikan, Kebudayaan, Riset dan Teknologi",,,35DO1997,23-06-1997,,,Silakan Upload SK,,,0 m2,1.,2.,,0272-326985,0272-320512,aamklaten01@gmail.com,wwww.aam-klaten.ac.id,,
Jawa Tengah,Kab. Klaten,Prambanan,https://sekolah.data.kemdikbud.go.id/index.php/Chome/profil/3491B4F1-2D7F-48A0-90F1-4BD573EE9B19,https://referensi.data.kemdikbud.go.id/pendidikan/npsn/70019744,Sekolah Tinggi Hindu Dharma Klaten Jawa Tengah,70019744,"Morangan Rt. 01 Rw. 01 Karanganom,  Kec. Klaten Utara, Kab. Klaten Jawa Tengah",SENGON,KEC. PRAMBANAN,KAB. KLATEN,PROV. JAWA TENGAH,NEGERI,Sekolah Tinggi,"Kementerian Pendidikan, Kebudayaan, Riset dan Teknologi",Pemerintah Pusat,,KEP. DIRJEN BIMAS HINDU DAN BUDHA NO. H/,03-03-1990,,,Silakan Upload SK,,,0 m2,1.,2.,,0272 3352795,0272 3352795,sthdjawatengah@gmail.com,sthd-jateng.ac.id,-7.735622600000,110.633040500000
Jawa Tengah,Kab. Klaten,Prambanan,https://sekolah.data.kemdikbud.go.id/index.php/Chome/profil/D7E094E3-862A-4DD6-9FFE-6E55F2AAC99D,https://referensi.data.kemdikbud.go.id/pendidikan/npsn/20332114,Sekolah Tinggi Ilmu Administrasi Madani,20332114,"Jl. Pilangsari, Gondang, Kebonarum, Klaten",SENGON,KEC. PRAMBANAN,KAB. KLATEN,PROV. JAWA TENGAH,SWASTA,Sekolah Tinggi,"Kementerian Pendidikan, Kebudayaan, Riset dan Teknologi",,,150D02002,08-02-2002,,,Silakan Upload SK,,,0 m2,1.,2.,,,,,,,
Jawa Tengah,Kab. Klaten,Prambanan,https://sekolah.data.kemdikbud.go.id/index.php/Chome/profil/0C169050-5628-41BD-B68E-0C3C1ADE04D0,https://referensi.data.kemdikbud.go.id/pendidikan/npsn/20332115,Sekolah Tinggi Ilmu Kesehatan Duta Gama Klaten,20332115,"Jl. Solo - Jogja KM.5 Ngaran, Mlese, Ceper, Klaten",SANGGRAHAN,KEC. PRAMBANAN,KAB. KLATEN,PROV. JAWA TENGAH,SWASTA,Sekolah Tinggi,"Kementerian Pendidikan, Kebudayaan, Riset dan Teknologi",,,125DO2005,05-09-2005,,,Silakan Upload SK,,,0 m2,1.,2.,,,,,,-7.686117800000,110.638589900000
Jawa Tengah,Kab. Klaten,Prambanan,https://sekolah.data.kemdikbud.go.id/index.php/Chome/profil/0B6A7D2C-DF2E-4928-AE65-8397FF27F19D,https://referensi.data.kemdikbud.go.id/pendidikan/npsn/70021031,"STAI Muhammadiyah (STAIM) Klaten, Jawa Tengah",70021031,Jl.Ki Ageng Gribig No.6 Klaten,KEBON DALEM KIDUL,KEC. PRAMBANAN,KAB. KLATEN,PROV. JAWA TENGAH,SWASTA,Sekolah Tinggi,"Kementerian Pendidikan, Kebudayaan, Riset dan Teknologi",,,031/III_JTg_70/79,06-10-1979,,,Silakan Upload SK,,,0 m2,1.,2.,,(0272) 321605,(0272) 321605,staim.klaten@gmail.com,www.staim-klaten.ac.id,,
Jawa Tengah,Kab. Klaten,Prambanan,https://sekolah.data.kemdikbud.go.id/index.php/Chome/profil/9EBC937F-15A5-4AE6-BD7F-1C65E9805158,https://referensi.data.kemdikbud.go.id/pendidikan/npsn/20332116,STIKES Muhammadiyah Klaten,20332116,Jl Jombor Indah Km 1 Klaten,JOHO,KEC. PRAMBANAN,KAB. KLATEN,PROV. JAWA TENGAH,SWASTA,Sekolah Tinggi,"Kementerian Pendidikan, Kebudayaan, Riset dan Teknologi",,,133DO2005,11-11-2005,,,Silakan Upload SK,,,16.480 m2,1.,2.,,,,,,-7.717871900000,110.600026700000
Jawa Tengah,Kab. Klaten,Prambanan,https://sekolah.data.kemdikbud.go.id/index.php/Chome/profil/EC7DC561-3A27-4367-98CD-EB430F6458F0,https://referensi.data.kemdikbud.go.id/pendidikan/npsn/20332117,Universitas Widya Dharma,20332117,Jalan Ki Hajar Dewantara,SANGGRAHAN,KEC. PRAMBANAN,KAB. KLATEN,PROV. JAWA TENGAH,SWASTA,Universitas,"Kementerian Pendidikan, Kebudayaan, Riset dan Teknologi",,,104DO1994,19-12-1994,,,Silakan Upload SK,,,0 m2,1.,2.,,(0272)322363,(0272)322363,info@unwidha.ac.id,www.unwidha.ac.id,-7.693064000000,110.624262000000
